17:38:17.828504 IP 192.168.1.1.53 > 192.168.1.100.64893: 28609 NXDomain 0/1/0 (97)
17:38:17.830278 IP 192.168.1.1.53 > 192.168.1.100.50915: 10735 NXDomain 0/1/0 (97)
17:38:21.525175 IP 51.79.154.29.443 > 192.168.1.105.37768: Flags [P.], seq 614767394:614767433, ack 178917360, win 83, options [nop,nop,TS val 26595541 ecr 2624194938], length 39
17:38:21.525196 IP 192.168.1.105.37768 > 51.79.154.29.443: Flags [.], ack 39, win 501, options [nop,nop,TS val 2624224927 ecr 26595541], length 0
17:38:21.525268 IP 51.79.154.29.443 > 192.168.1.105.37768: Flags [FP.], seq 39:63, ack 1, win 83, options [nop,nop,TS val 26595541 ecr 2624194938], length 24
17:38:21.525422 IP 192.168.1.105.37768 > 51.79.154.29.443: Flags [P.], seq 1:40, ack 64, win 501, options [nop,nop,TS val 2624224927 ecr 26595541], length 39
17:38:21.525563 IP 192.168.1.105.37768 > 51.79.154.29.443: Flags [P.], seq 40:64, ack 64, win 501, options [nop,nop,TS val 2624224927 ecr 26595541], length 24
17:38:21.525640 IP 192.168.1.105.37768 > 51.79.154.29.443: Flags [F.], seq 64, ack 64, win 501, options [nop,nop,TS val 2624224927 ecr 26595541], length 0
17:38:21.617841 IP 51.79.152.81.443 > 192.168.1.100.52196: Flags [P.], seq 3556939242:3556939266, ack 688418718, win 83, length 24
17:38:21.618794 IP 51.79.152.81.443 > 192.168.1.100.52196: Flags [F.], seq 24, ack 1, win 83, length 0
17:38:21.668674 IP 51.79.154.29.443 > 192.168.1.105.37768: Flags [R], seq 614767458, win 0, length 0
17:38:21.668698 IP 51.79.154.29.443 > 192.168.1.105.37768: Flags [R], seq 614767458, win 0, length 0
17:38:21.668702 IP 51.79.154.29.443 > 192.168.1.105.37768: Flags [R], seq 614767458, win 0, length 0
17:38:21.723015 IP 192.168.1.105.42644 > 34.96.71.22.443: Flags [P.], seq 3298592650:3298592689, ack 1347080081, win 493, options [nop,nop,TS val 4257745886 ecr 1545834182], length 39
17:38:21.794925 IP 34.96.71.22.443 > 192.168.1.105.42644: Flags [P.], seq 1:40, ack 39, win 287, options [nop,nop,TS val 1545893064 ecr 4257745886], length 39
17:38:21.796563 IP 34.96.71.22.443 > 192.168.1.105.42644: Flags [.], ack 39, win 287, options [nop,nop,TS val 1545893064 ecr 4257745886], length 0
17:38:21.835961 IP 192.168.1.105.42644 > 34.96.71.22.443: Flags [.], ack 40, win 493, options [nop,nop,TS val 4257745999 ecr 1545893064], length 0
17:38:21.927579 IP 103.119.125.60.443 > 192.168.1.100.52199: Flags [.], ack 3144628109, win 293, length 0
17:38:21.928564 IP 103.119.125.60.443 > 192.168.1.100.52200: Flags [.], ack 408626982, win 270, length 0
17:38:21.929666 IP 103.119.125.60.443 > 192.168.1.100.52207: Flags [S.], seq 1591958657, ack 1987962354, win 29200, options [mss 1200,nop,nop,sackOK,nop,wscale 7], length 0
17:38:22.027532 IP 51.79.152.81.443 > 192.168.1.100.52196: Flags [.], ack 2, win 83, length 0
17:38:22.028601 IP 103.119.125.60.443 > 192.168.1.100.52207: Flags [.], ack 1, win 240, options [nop,nop,sack 1 {1201:1939}], length 0
17:38:22.029611 IP 103.119.125.60.443 > 192.168.1.100.52207: Flags [.], ack 1939, win 263, length 0
17:38:22.031792 IP 103.119.125.60.443 > 192.168.1.100.52207: Flags [P.], seq 1:138, ack 1939, win 263, length 137
17:38:22.127571 IP 103.119.125.60.443 > 192.168.1.100.52207: Flags [.], ack 1990, win 282, options [nop,nop,sack 1 {3190:3258}], length 0
17:38:22.128534 IP 103.119.125.60.443 > 192.168.1.100.52207: Flags [.], ack 3258, win 305, length 0
17:38:22.247541 IP 103.119.125.60.443 > 192.168.1.100.52207: Flags [.], seq 138:1338, ack 3258, win 305, length 1200
17:38:22.251403 IP 103.119.125.60.443 > 192.168.1.100.52207: Flags [P.], seq 1338:1351, ack 3258, win 305, length 13
17:38:22.412744 IP 192.168.1.105.48122 > 52.204.201.175.443: Flags [.], ack 70114152, win 501, options [nop,nop,TS val 1675398678 ecr 425221915], length 0
17:38:22.412885 IP 192.168.1.105.34876 > 119.160.63.72.443: Flags [.], ack 2334863821, win 481, options [nop,nop,TS val 470077193 ecr 2300807550], length 0
17:38:22.456438 IP 119.160.63.72.443 > 192.168.1.105.34876: Flags [.], ack 1, win 501, options [nop,nop,TS val 2300817792 ecr 470046312], length 0
17:38:22.545627 IP 192.168.1.105.48122 > 52.204.201.175.443: Flags [P.], seq 1:583, ack 1, win 501, options [nop,nop,TS val 1675398810 ecr 425221915], length 582
17:38:22.546538 IP 192.168.1.105.34624 > 52.204.201.175.443: Flags [S], seq 4041064261, win 64240, options [mss 1460,sackOK,TS val 1675398811 ecr 0,nop,wscale 7], length 0
17:38:22.546635 IP 192.168.1.105.53489 > 192.168.1.1.53: 50763+ AAAA? pghbl1.pubgalaxy.com. (38)
17:38:22.549882 IP 192.168.1.1.53 > 192.168.1.105.53489: 50763 0/0/0 (38)
17:38:22.573918 IP 192.168.1.105.53286 > 172.67.23.234.443: Flags [P.], seq 2675670110:2675670185, ack 1364495961, win 501, options [nop,nop,TS val 2602659031 ecr 204516515], length 75
17:38:22.636344 IP 172.67.23.234.443 > 192.168.1.105.53286: Flags [.], ack 75, win 14, options [nop,nop,TS val 204548064 ecr 2602659031], length 0
17:38:22.656444 IP 52.204.201.175.443 > 192.168.1.105.48122: Flags [.], ack 1, win 549, options [nop,nop,TS val 425232638 ecr 1675367086], length 0
17:38:22.683934 IP 192.168.1.105.43760 > 18.64.140.237.443: Flags [P.], seq 2039309977:2039311387, ack 456739901, win 357, options [nop,nop,TS val 1270813717 ecr 3037964891], length 1410
17:38:22.684162 IP 192.168.1.105.48825 > 192.168.1.1.53: 59644+ A? aax.amazon-adsystem.com. (41)
17:38:22.684406 IP 192.168.1.105.48828 > 192.168.1.1.53: 53250+ AAAA? aax.amazon-adsystem.com. (41)
17:38:22.723593 IP 192.168.1.105.41426 > 89.207.22.73.443: Flags [P.], seq 315797324:315797363, ack 3766986140, win 501, options [nop,nop,TS val 3583020816 ecr 2296506680], length 39
17:38:22.747586 IP 192.168.1.1.53 > 192.168.1.105.48828: 53250 3/1/0 CNAME aax-dtb-cf.amazon-adsystem.com., CNAME aax-dtb-cf.amazon-adsystem.amazon.com., CNAME d1jvc9b8z3vcjs.cloudfront.net. (234)
17:38:22.747901 IP 192.168.1.105.41736 > 192.168.1.1.53: 46567+ AAAA? d1jvc9b8z3vcjs.cloudfront.net. (47)
17:38:22.751593 IP 192.168.1.1.53 > 192.168.1.105.48825: 59644 4/0/0 CNAME aax-dtb-cf.amazon-adsystem.com., CNAME aax-dtb-cf.amazon-adsystem.amazon.com., CNAME d1jvc9b8z3vcjs.cloudfront.net., A 18.64.140.237 (173)
17:38:22.751614 IP 192.168.1.1.53 > 192.168.1.105.41736: 46567 0/0/0 (47)
17:38:22.786294 IP 18.64.140.237.443 > 192.168.1.105.43760: Flags [.], ack 1410, win 348, options [nop,nop,TS val 3037996372 ecr 1270813717], length 0
17:38:22.796423 IP 52.204.201.175.443 > 192.168.1.105.34624: Flags [S.], seq 907957663, ack 4041064262, win 26847, options [mss 1460,sackOK,TS val 425232780 ecr 1675398811,nop,wscale 7], length 0
17:38:22.796447 IP 192.168.1.105.34624 > 52.204.201.175.443: Flags [.], ack 1, win 502, options [nop,nop,TS val 1675399061 ecr 425232780], length 0
17:38:22.797601 IP 192.168.1.105.34624 > 52.204.201.175.443: Flags [P.], seq 1:861, ack 1, win 502, options [nop,nop,TS val 1675399062 ecr 425232780], length 860
17:38:22.806821 IP 52.204.201.175.443 > 192.168.1.105.48122: Flags [P.], seq 1:336, ack 583, win 558, options [nop,nop,TS val 425232788 ecr 1675398810], length 335
17:38:22.806844 IP 192.168.1.105.48122 > 52.204.201.175.443: Flags [.], ack 336, win 501, options [nop,nop,TS val 1675399072 ecr 425232788], length 0
17:38:22.839729 IP 172.67.23.234.443 > 192.168.1.105.53286: Flags [P.], seq 1:83, ack 75, win 14, options [nop,nop,TS val 204548275 ecr 2602659031], length 82
17:38:22.840841 IP 192.168.1.105.53286 > 172.67.23.234.443: Flags [P.], seq 75:150, ack 83, win 501, options [nop,nop,TS val 2602659298 ecr 204548275], length 75
17:38:22.841031 IP 192.168.1.105.53286 > 172.67.23.234.443: Flags [P.], seq 150:1546, ack 83, win 501, options [nop,nop,TS val 2602659298 ecr 204548275], length 1396
17:38:22.847614 ARP, Request who-has 192.168.1.100 tell 192.168.1.1, length 46
17:38:22.882070 IP 192.168.1.105.41244 > 192.168.1.1.53: 502+ A? pbs.360yield.com. (34)
17:38:22.882413 IP 192.168.1.105.49486 > 3.123.249.217.443: Flags [P.], seq 4034326109:4034326188, ack 2700555312, win 501, options [nop,nop,TS val 255972703 ecr 3390223958], length 79
17:38:22.882497 IP 192.168.1.105.49486 > 3.123.249.217.443: Flags [P.], seq 79:1689, ack 1, win 501, options [nop,nop,TS val 255972703 ecr 3390223958], length 1610
17:38:22.882652 IP 192.168.1.105.49486 > 3.123.249.217.443: Flags [P.], seq 1689:4585, ack 1, win 501, options [nop,nop,TS val 255972703 ecr 3390223958], length 2896
17:38:22.882777 IP 192.168.1.105.49486 > 3.123.249.217.443: Flags [P.], seq 4585:6379, ack 1, win 501, options [nop,nop,TS val 255972703 ecr 3390223958], length 1794
17:38:22.888523 IP 192.168.1.105.39861 > 192.168.1.1.53: 59969+ A? as-tlx.3lift.com. (34)
17:38:22.889037 IP 192.168.1.105.54064 > 192.168.1.1.53: 6912+ AAAA? s.seedtag.com. (31)
17:38:22.889529 IP 192.168.1.105.58712 > 34.149.50.64.443: Flags [P.], seq 1443225369:1443225447, ack 4281906756, win 501, options [nop,nop,TS val 883617058 ecr 2077651044], length 78
17:38:22.889626 IP 192.168.1.105.58712 > 34.149.50.64.443: Flags [P.], seq 78:1093, ack 1, win 501, options [nop,nop,TS val 883617058 ecr 2077651044], length 1015
17:38:22.889844 IP 192.168.1.105.58712 > 34.149.50.64.443: Flags [P.], seq 1093:1715, ack 1, win 501, options [nop,nop,TS val 883617059 ecr 2077651044], length 622
17:38:22.892733 IP 192.168.1.105.51013 > 192.168.1.1.53: 13164+ AAAA? bidder.sg1.vip.prod.criteo.com. (48)
17:38:22.896488 IP 192.168.1.105.47038 > 3.0.107.214.443: Flags [P.], seq 3061789634:3061789808, ack 4289483865, win 450, options [nop,nop,TS val 3703878397 ecr 3837338546], length 174
17:38:22.896620 IP 192.168.1.105.47038 > 3.0.107.214.443: Flags [P.], seq 174:1658, ack 1, win 450, options [nop,nop,TS val 3703878397 ecr 3837338546], length 1484
17:38:22.896778 IP 192.168.1.105.47038 > 3.0.107.214.443: Flags [P.], seq 1658:3524, ack 1, win 450, options [nop,nop,TS val 3703878398 ecr 3837338546], length 1866
17:38:22.897368 IP 192.168.1.1.53 > 192.168.1.105.54064: 6912 0/0/0 (31)
17:38:22.897391 IP 192.168.1.1.53 > 192.168.1.105.51013: 13164 0/0/0 (48)
17:38:22.900854 IP 192.168.1.105.40970 > 192.168.1.1.53: 16595+ A? ap.lijit.com. (30)
17:38:22.902571 IP 192.168.1.105.43002 > 182.161.73.145.443: Flags [S], seq 2667106158, win 64240, options [mss 1460,sackOK,TS val 2145350609 ecr 0,nop,wscale 7], length 0
17:38:22.904188 IP 192.168.1.105.45957 > 192.168.1.1.53: 20489+ AAAA? onetag-sys.com. (32)
17:38:22.905472 IP 192.168.1.105.49116 > 52.51.148.13.443: Flags [P.], seq 1838353514:1838353610, ack 3938435050, win 501, options [nop,nop,TS val 1669662280 ecr 2801928888], length 96
17:38:22.905581 IP 192.168.1.105.49116 > 52.51.148.13.443: Flags [P.], seq 96:1694, ack 1, win 501, options [nop,nop,TS val 1669662280 ecr 2801928888], length 1598
17:38:22.906293 IP 172.67.23.234.443 > 192.168.1.105.53286: Flags [.], ack 150, win 14, options [nop,nop,TS val 204548340 ecr 2602659298], length 0
17:38:22.906329 IP 192.168.1.105.39530 > 172.64.153.78.443: Flags [P.], seq 372379530:372379602, ack 4084564409, win 501, options [nop,nop,TS val 2219226180 ecr 952696481], length 72
17:38:22.906401 IP 192.168.1.105.39530 > 172.64.153.78.443: Flags [P.], seq 72:1698, ack 1, win 501, options [nop,nop,TS val 2219226180 ecr 952696481], length 1626
17:38:22.907124 IP 192.168.1.105.39530 > 172.64.153.78.443: Flags [P.], seq 1698:2529, ack 1, win 501, options [nop,nop,TS val 2219226181 ecr 952696481], length 831
17:38:22.907221 IP 192.168.1.105.49116 > 52.51.148.13.443: Flags [P.], seq 1694:2524, ack 1, win 501, options [nop,nop,TS val 1669662282 ecr 2801928888], length 830
17:38:22.908942 IP 192.168.1.1.53 > 192.168.1.105.45957: 20489 0/0/0 (32)
17:38:22.910376 IP 192.168.1.105.59896 > 51.79.154.29.443: Flags [S], seq 2831274435, win 64240, options [mss 1460,sackOK,TS val 2624226312 ecr 0,nop,wscale 7], length 0
17:38:22.913662 IP 192.168.1.105.46139 > 192.168.1.1.53: 45427+ AAAA? report2.hb.brainlyads.com. (43)
17:38:22.916569 IP 192.168.1.1.53 > 192.168.1.105.46139: 45427 0/0/0 (43)
17:38:22.916592 IP 172.67.23.234.443 > 192.168.1.105.53286: Flags [.], ack 1538, win 14, options [nop,nop,TS val 204548351 ecr 2602659298], length 0
17:38:22.917103 IP 192.168.1.105.33561 > 192.168.1.1.53: 6424+ A? pbs.nextmillmedia.com. (39)
17:38:22.919023 IP 192.168.1.105.43608 > 51.81.244.170.443: Flags [P.], seq 4111311761:4111311858, ack 2469093299, win 501, options [nop,nop,TS val 3149405452 ecr 3198317983], length 97
17:38:22.919154 IP 192.168.1.105.43608 > 51.81.244.170.443: Flags [P.], seq 97:1246, ack 1, win 501, options [nop,nop,TS val 3149405452 ecr 3198317983], length 1149
17:38:22.919358 IP 192.168.1.105.43608 > 51.81.244.170.443: Flags [P.], seq 1246:1966, ack 1, win 501, options [nop,nop,TS val 3149405452 ecr 3198317983], length 720
17:38:22.920223 IP 192.168.1.105.45354 > 54.84.92.154.443: Flags [S], seq 448602130, win 64240, options [mss 1460,sackOK,TS val 1154370877 ecr 0,nop,wscale 7], length 0
17:38:22.920505 IP 192.168.1.105.52906 > 103.43.90.179.443: Flags [S], seq 1421697698, win 64240, options [mss 1460,sackOK,TS val 1793751790 ecr 0,nop,wscale 7], length 0
17:38:22.926223 IP 172.67.23.234.443 > 192.168.1.105.53286: Flags [.], ack 1546, win 14, options [nop,nop,TS val 204548357 ecr 2602659298], length 0
17:38:22.926274 IP 192.168.1.105.41881 > 192.168.1.1.53: 59228+ A? fastlane.rubiconproject.com. (45)
17:38:22.926440 IP 192.168.1.105.55570 > 192.168.1.1.53: 37379+ AAAA? fastlane.rubiconproject.com. (45)
17:38:22.927073 IP 192.168.1.105.41672 > 69.173.158.65.443: Flags [S], seq 3891448298, win 64240, options [mss 1460,sackOK,TS val 2379307208 ecr 0,nop,wscale 7], length 0
17:38:22.946512 IP 192.168.1.1.53 > 192.168.1.105.41244: 502 3/0/0 A 52.28.189.81, A 3.123.249.217, A 35.156.108.223 (82)
17:38:22.946559 IP 192.168.1.1.53 > 192.168.1.105.39861: 59969 3/0/0 A 54.151.166.244, A 54.169.90.152, A 3.0.107.214 (82)
17:38:22.947105 IP 192.168.1.105.54253 > 192.168.1.1.53: 38978+ AAAA? pbs.360yield.com. (34)
17:38:22.947473 IP 192.168.1.1.53 > 192.168.1.105.40970: 16595 12/0/0 CNAME vap.lijit.com., CNAME emeas.vap.lijit.com., CNAME eu.vap.lijit.com., CNAME blackbird-prd-ew1-alb-87915139.eu-west-1.elb.amazonaws.com., A 52.49.93.139, A 108.128.5.110, A 34.249.95.85, A 52.51.148.13, A 34.246.12.184, A 34.250.128.141, A 54.73.30.37, A 46.137.29.45 (282)
17:38:22.949661 IP 192.168.1.1.53 > 192.168.1.105.33561: 6424 5/0/0 CNAME pbs.weight.ovhnextmillmedia.com., CNAME vin.pbs.ovhnextmillmedia.com., CNAME new_vin.pbs.ovhnextmillmedia.com., CNAME vin5.pbs.ovhnextmillmedia.com., A 15.204.162.92 (160)
17:38:22.949868 IP 192.168.1.105.35509 > 192.168.1.1.53: 53629+ AAAA? blackbird-prd-ew1-alb-87915139.eu-west-1.elb.amazonaws.com. (76)
17:38:22.950134 IP 192.168.1.105.35286 > 192.168.1.1.53: 39465+ AAAA? as-tlx.3lift.com. (34)
17:38:22.950390 IP 192.168.1.1.53 > 192.168.1.105.54253: 38978 0/0/0 (34)
17:38:22.950938 IP 192.168.1.105.39290 > 192.168.1.1.53: 23644+ AAAA? vin5.pbs.ovhnextmillmedia.com. (47)
17:38:22.953395 IP 192.168.1.1.53 > 192.168.1.105.35286: 39465 0/0/0 (34)
17:38:22.966830 IP 172.64.153.78.443 > 192.168.1.105.39530: Flags [.], ack 72, win 16, options [nop,nop,TS val 952728095 ecr 2219226180], length 0
17:38:22.966841 IP 172.64.153.78.443 > 192.168.1.105.39530: Flags [.], ack 1698, win 16, options [nop,nop,TS val 952728095 ecr 2219226180], length 0
17:38:22.966844 IP 172.64.153.78.443 > 192.168.1.105.39530: Flags [.], ack 2529, win 16, options [nop,nop,TS val 952728095 ecr 2219226181], length 0
17:38:22.967561 IP 192.168.1.1.53 > 192.168.1.105.55570: 37379 2/0/0 CNAME tagged-by.rubiconproject.net.akadns.net., AAAA 2602:803:c006:158::65 (126)
17:38:22.969849 IP 192.168.1.1.53 > 192.168.1.105.41881: 59228 2/0/0 CNAME tagged-by.rubiconproject.net.akadns.net., A 69.173.158.65 (114)
17:38:22.976053 IP 34.149.50.64.443 > 192.168.1.105.58712: Flags [.], ack 78, win 396, options [nop,nop,TS val 2077682576 ecr 883617058], length 0
17:38:22.976067 IP 34.149.50.64.443 > 192.168.1.105.58712: Flags [.], ack 1093, win 393, options [nop,nop,TS val 2077682576 ecr 883617058], length 0
17:38:22.976069 IP 34.149.50.64.443 > 192.168.1.105.58712: Flags [.], ack 1715, win 391, options [nop,nop,TS val 2077682576 ecr 883617059], length 0
17:38:22.985412 IP 192.168.1.1.53 > 192.168.1.105.39290: 23644 0/1/0 (128)
17:38:22.995589 IP 192.168.1.1.53 > 192.168.1.105.35509: 53629 0/1/0 (158)
17:38:23.025751 IP 182.161.73.145.443 > 192.168.1.105.43002: Flags [S.], seq 2696193769, ack 2667106159, win 65160, options [mss 1460,sackOK,TS val 626821583 ecr 2145350609,nop,wscale 10], length 0
17:38:23.025783 IP 192.168.1.105.43002 > 182.161.73.145.443: Flags [.], ack 1, win 502, options [nop,nop,TS val 2145350733 ecr 626821583], length 0
17:38:23.028637 IP 192.168.1.105.43002 > 182.161.73.145.443: Flags [P.], seq 1:1289, ack 1, win 502, options [nop,nop,TS val 2145350735 ecr 626821583], length 1288
17:38:23.028925 IP 192.168.1.105.43002 > 182.161.73.145.443: Flags [P.], seq 1289:1295, ack 1, win 502, options [nop,nop,TS val 2145350736 ecr 626821583], length 6
17:38:23.029007 IP 192.168.1.105.43002 > 182.161.73.145.443: Flags [P.], seq 1295:1465, ack 1, win 502, options [nop,nop,TS val 2145350736 ecr 626821583], length 170
17:38:23.036014 IP 3.0.107.214.443 > 192.168.1.105.47038: Flags [.], ack 0, win 27, options [nop,nop,TS val 3837370437 ecr 3703866359,nop,nop,sack 1 {174:1622}], length 0
17:38:23.036033 IP 3.0.107.214.443 > 192.168.1.105.47038: Flags [.], ack 0, win 27, options [nop,nop,TS val 3837370437 ecr 3703866359,nop,nop,sack 2 {1658:3106}{174:1622}], length 0
17:38:23.037680 IP 3.0.107.214.443 > 192.168.1.105.47038: Flags [P.], seq 1:75, ack 3524, win 27, options [nop,nop,TS val 3837370439 ecr 3703878398], length 74
17:38:23.037712 IP 192.168.1.105.47038 > 3.0.107.214.443: Flags [.], ack 75, win 450, options [nop,nop,TS val 3703878539 ecr 3837370439], length 0
17:38:23.037800 IP 51.79.154.29.443 > 192.168.1.105.59896: Flags [S.], seq 1902595631, ack 2831274436, win 43440, options [mss 1460,sackOK,TS val 26597048 ecr 2624226312,nop,wscale 9], length 0
17:38:23.037815 IP 192.168.1.105.59896 > 51.79.154.29.443: Flags [.], ack 1, win 502, options [nop,nop,TS val 2624226440 ecr 26597048], length 0
17:38:23.037861 IP 103.43.90.179.443 > 192.168.1.105.52906: Flags [S.], seq 1394406386, ack 1421697699, win 43440, options [mss 1460,sackOK,TS val 1650453664 ecr 1793751790,nop,wscale 9], length 0
17:38:23.037871 IP 192.168.1.105.52906 > 103.43.90.179.443: Flags [.], ack 1, win 502, options [nop,nop,TS val 1793751908 ecr 1650453664], length 0
17:38:23.039971 IP 192.168.1.105.59896 > 51.79.154.29.443: Flags [P.], seq 1:1222, ack 1, win 502, options [nop,nop,TS val 2624226442 ecr 26597048], length 1221
17:38:23.040265 IP 192.168.1.105.59896 > 51.79.154.29.443: Flags [P.], seq 1222:1228, ack 1, win 502, options [nop,nop,TS val 2624226442 ecr 26597048], length 6
17:38:23.040344 IP 192.168.1.105.59896 > 51.79.154.29.443: Flags [P.], seq 1228:1398, ack 1, win 502, options [nop,nop,TS val 2624226442 ecr 26597048], length 170
17:38:23.041407 IP 192.168.1.105.52906 > 103.43.90.179.443: Flags [P.], seq 1:869, ack 1, win 502, options [nop,nop,TS val 1793751911 ecr 1650453664], length 868
17:38:23.043561 IP 52.204.201.175.443 > 192.168.1.105.34624: Flags [P.], seq 1:153, ack 861, win 224, options [nop,nop,TS val 425233026 ecr 1675399062], length 152
17:38:23.043594 IP 192.168.1.105.34624 > 52.204.201.175.443: Flags [.], ack 153, win 501, options [nop,nop,TS val 1675399308 ecr 425233026], length 0
17:38:23.043871 IP 192.168.1.105.34624 > 52.204.201.175.443: Flags [P.], seq 861:912, ack 153, win 501, options [nop,nop,TS val 1675399309 ecr 425233026], length 51
17:38:23.046418 IP 3.0.107.214.443 > 192.168.1.105.47038: Flags [.], ack 1622, win 27, options [nop,nop,TS val 3837370439 ecr 3703878397,nop,nop,sack 1 {1658:3106}], length 0
17:38:23.046460 IP 192.168.1.105.47038 > 3.0.107.214.443: Flags [.], ack 75, win 450, options [nop,nop,TS val 3703878547 ecr 3837370439], length 0
17:38:23.046538 IP 3.0.107.214.443 > 192.168.1.105.47038: Flags [.], ack 3106, win 27, options [nop,nop,TS val 3837370439 ecr 3703878397], length 0
17:38:23.046541 IP 3.0.107.214.443 > 192.168.1.105.47038: Flags [.], ack 3524, win 27, options [nop,nop,TS val 3837370439 ecr 3703878398], length 0
17:38:23.046542 IP 52.204.201.175.443 > 192.168.1.105.34624: Flags [.], ack 861, win 224, options [nop,nop,TS val 425233025 ecr 1675399062], length 0
17:38:23.046546 IP 192.168.1.105.34624 > 52.204.201.175.443: Flags [.], ack 153, win 501, options [nop,nop,TS val 1675399311 ecr 425233026], length 0
17:38:23.048443 IP 3.0.107.214.443 > 192.168.1.105.47038: Flags [P.], seq 75:522, ack 3524, win 27, options [nop,nop,TS val 3837370458 ecr 3703878398], length 447
17:38:23.048496 IP 192.168.1.105.47038 > 3.0.107.214.443: Flags [.], ack 522, win 447, options [nop,nop,TS val 3703878549 ecr 3837370458], length 0
17:38:23.056661 IP 69.173.158.65.443 > 192.168.1.105.41672: Flags [S.], seq 3942612342, ack 3891448299, win 14600, options [mss 1460,nop,wscale 2,sackOK,TS val 2368795168 ecr 2379307208], length 0
17:38:23.056686 IP 192.168.1.105.41672 > 69.173.158.65.443: Flags [.], ack 1, win 502, options [nop,nop,TS val 2379307338 ecr 2368795168], length 0
17:38:23.058627 IP 192.168.1.105.41672 > 69.173.158.65.443: Flags [P.], seq 1:1295, ack 1, win 502, options [nop,nop,TS val 2379307339 ecr 2368795168], length 1294
17:38:23.069143 IP 3.123.249.217.443 > 192.168.1.105.49486: Flags [.], ack 0, win 425, options [nop,nop,TS val 3390255743 ecr 255941107,nop,nop,sack 1 {79:1527}], length 0
17:38:23.069160 IP 3.123.249.217.443 > 192.168.1.105.49486: Flags [.], ack 1527, win 425, options [nop,nop,TS val 3390255743 ecr 255972703], length 0
17:38:23.079177 IP 3.123.249.217.443 > 192.168.1.105.49486: Flags [P.], seq 1:36, ack 1689, win 425, options [nop,nop,TS val 3390255755 ecr 255972703], length 35
17:38:23.079211 IP 192.168.1.105.49486 > 3.123.249.217.443: Flags [.], ack 36, win 501, options [nop,nop,TS val 255972900 ecr 3390255755], length 0
17:38:23.085911 IP 3.123.249.217.443 > 192.168.1.105.49486: Flags [.], ack 1689, win 425, options [nop,nop,TS val 3390255755 ecr 255972703], length 0
17:38:23.085930 IP 192.168.1.105.49486 > 3.123.249.217.443: Flags [.], ack 36, win 501, options [nop,nop,TS val 255972907 ecr 3390255755], length 0
17:38:23.086030 IP 3.123.249.217.443 > 192.168.1.105.49486: Flags [.], ack 4585, win 425, options [nop,nop,TS val 3390255755 ecr 255972703], length 0
17:38:23.086044 IP 3.123.249.217.443 > 192.168.1.105.49486: Flags [.], ack 6379, win 425, options [nop,nop,TS val 3390255756 ecr 255972703], length 0
17:38:23.116465 IP 52.51.148.13.443 > 192.168.1.105.49116: Flags [.], ack 1694, win 425, options [nop,nop,TS val 2801960759 ecr 1669662280], length 0
17:38:23.118802 IP 18.64.140.237.443 > 192.168.1.105.43760: Flags [P.], seq 1:577, ack 1410, win 348, options [nop,nop,TS val 3037996714 ecr 1270813717], length 576
17:38:23.118837 IP 192.168.1.105.43760 > 18.64.140.237.443: Flags [.], ack 577, win 353, options [nop,nop,TS val 1270814152 ecr 3037996714], length 0
17:38:23.118924 IP 89.207.22.73.443 > 192.168.1.105.41426: Flags [P.], seq 1:40, ack 39, win 249, options [nop,nop,TS val 2296565316 ecr 3583020816], length 39
17:38:23.118931 IP 192.168.1.105.41426 > 89.207.22.73.443: Flags [.], ack 40, win 501, options [nop,nop,TS val 3583021212 ecr 2296565316], length 0
17:38:23.122312 IP 18.64.140.237.443 > 192.168.1.105.43760: Flags [P.], seq 577:608, ack 1410, win 348, options [nop,nop,TS val 3037996716 ecr 1270813717], length 31
17:38:23.122338 IP 192.168.1.105.43760 > 18.64.140.237.443: Flags [.], ack 608, win 353, options [nop,nop,TS val 1270814155 ecr 3037996716], length 0
17:38:23.140446 IP 172.67.23.234.443 > 192.168.1.105.53286: Flags [P.], seq 83:166, ack 1546, win 14, options [nop,nop,TS val 204548577 ecr 2602659298], length 83
17:38:23.140470 IP 172.67.23.234.443 > 192.168.1.105.53286: Flags [P.], seq 166:224, ack 1546, win 14, options [nop,nop,TS val 204548577 ecr 2602659298], length 58
17:38:23.140472 IP 172.67.23.234.443 > 192.168.1.105.53286: Flags [P.], seq 224:255, ack 1546, win 14, options [nop,nop,TS val 204548577 ecr 2602659298], length 31
17:38:23.141230 IP 192.168.1.105.53286 > 172.67.23.234.443: Flags [.], ack 255, win 501, options [nop,nop,TS val 2602659598 ecr 204548577], length 0
17:38:23.146924 IP 52.51.148.13.443 > 192.168.1.105.49116: Flags [P.], seq 1:698, ack 2524, win 425, options [nop,nop,TS val 2801960794 ecr 1669662282], length 697
17:38:23.146943 IP 192.168.1.105.49116 > 52.51.148.13.443: Flags [.], ack 698, win 501, options [nop,nop,TS val 1669662522 ecr 2801960794], length 0
17:38:23.147050 IP 52.51.148.13.443 > 192.168.1.105.49116: Flags [P.], seq 698:729, ack 2524, win 425, options [nop,nop,TS val 2801960794 ecr 1669662282], length 31
17:38:23.147056 IP 192.168.1.105.49116 > 52.51.148.13.443: Flags [.], ack 729, win 501, options [nop,nop,TS val 1669662522 ecr 2801960794], length 0
17:38:23.152143 IP 54.84.92.154.443 > 192.168.1.105.45354: Flags [S.], seq 1701799930, ack 448602131, win 65535, options [mss 1460,sackOK,TS val 3977395676 ecr 1154370877,nop,wscale 12], length 0
17:38:23.152177 IP 192.168.1.105.45354 > 54.84.92.154.443: Flags [.], ack 1, win 502, options [nop,nop,TS val 1154371109 ecr 3977395676], length 0
17:38:23.153335 IP 192.168.1.105.45354 > 54.84.92.154.443: Flags [P.], seq 1:845, ack 1, win 502, options [nop,nop,TS val 1154371110 ecr 3977395676], length 844
17:38:23.169096 IP 34.149.50.64.443 > 192.168.1.105.58712: Flags [P.], seq 1:442, ack 1715, win 396, options [nop,nop,TS val 2077682772 ecr 883617059], length 441
17:38:23.171612 IP 34.149.50.64.443 > 192.168.1.105.58712: Flags [P.], seq 442:484, ack 1715, win 396, options [nop,nop,TS val 2077682773 ecr 883617059], length 42
17:38:23.171627 IP 34.149.50.64.443 > 192.168.1.105.58712: Flags [P.], seq 484:523, ack 1715, win 396, options [nop,nop,TS val 2077682773 ecr 883617059], length 39
17:38:23.171917 IP 192.168.1.105.58712 > 34.149.50.64.443: Flags [.], ack 523, win 501, options [nop,nop,TS val 883617341 ecr 2077682772], length 0
17:38:23.172065 IP 192.168.1.105.58712 > 34.149.50.64.443: Flags [P.], seq 1715:1754, ack 523, win 501, options [nop,nop,TS val 883617341 ecr 2077682772], length 39
17:38:23.174352 IP 51.79.154.29.443 > 192.168.1.105.59896: Flags [P.], seq 1:243, ack 1398, win 83, options [nop,nop,TS val 26597192 ecr 2624226442], length 242
17:38:23.174373 IP 192.168.1.105.59896 > 51.79.154.29.443: Flags [.], ack 243, win 501, options [nop,nop,TS val 2624226576 ecr 26597192], length 0
17:38:23.174441 IP 103.43.90.179.443 > 192.168.1.105.52906: Flags [P.], seq 1:151, ack 869, win 83, options [nop,nop,TS val 1650453857 ecr 1793751911], length 150
17:38:23.174447 IP 192.168.1.105.52906 > 103.43.90.179.443: Flags [.], ack 151, win 501, options [nop,nop,TS val 1793752044 ecr 1650453857], length 0
17:38:23.176299 IP 51.79.154.29.443 > 192.168.1.105.59896: Flags [.], ack 1398, win 83, options [nop,nop,TS val 26597192 ecr 2624226442], length 0
17:38:23.176310 IP 192.168.1.105.59896 > 51.79.154.29.443: Flags [.], ack 243, win 501, options [nop,nop,TS val 2624226578 ecr 26597192], length 0
17:38:23.176381 IP 103.43.90.179.443 > 192.168.1.105.52906: Flags [.], ack 869, win 82, options [nop,nop,TS val 1650453857 ecr 1793751911], length 0
17:38:23.176385 IP 192.168.1.105.52906 > 103.43.90.179.443: Flags [.], ack 151, win 501, options [nop,nop,TS val 1793752046 ecr 1650453857], length 0
17:38:23.176581 IP 192.168.1.105.59896 > 51.79.154.29.443: Flags [P.], seq 1398:1482, ack 243, win 501, options [nop,nop,TS val 2624226578 ecr 26597192], length 84
17:38:23.178186 IP 192.168.1.105.52906 > 103.43.90.179.443: Flags [P.], seq 869:920, ack 151, win 501, options [nop,nop,TS val 1793752048 ecr 1650453857], length 51
17:38:23.178669 IP 192.168.1.105.59896 > 51.79.154.29.443: Flags [P.], seq 1482:1794, ack 243, win 501, options [nop,nop,TS val 2624226581 ecr 26597192], length 312
17:38:23.178765 IP 192.168.1.105.59896 > 51.79.154.29.443: Flags [P.], seq 1794:4690, ack 243, win 501, options [nop,nop,TS val 2624226581 ecr 26597192], length 2896
17:38:23.178838 IP 192.168.1.105.59896 > 51.79.154.29.443: Flags [P.], seq 4690:5187, ack 243, win 501, options [nop,nop,TS val 2624226581 ecr 26597192], length 497
17:38:23.178947 IP 192.168.1.105.52906 > 103.43.90.179.443: Flags [P.], seq 920:1097, ack 151, win 501, options [nop,nop,TS val 1793752049 ecr 1650453857], length 177
17:38:23.179010 IP 192.168.1.105.52906 > 103.43.90.179.443: Flags [P.], seq 1097:1414, ack 151, win 501, options [nop,nop,TS val 1793752049 ecr 1650453857], length 317
17:38:23.179087 IP 192.168.1.105.52906 > 103.43.90.179.443: Flags [P.], seq 1414:3186, ack 151, win 501, options [nop,nop,TS val 1793752049 ecr 1650453857], length 1772
17:38:23.181806 IP 182.161.73.145.443 > 192.168.1.105.43002: Flags [P.], seq 1:243, ack 1465, win 63, options [nop,nop,TS val 626821745 ecr 2145350735], length 242
17:38:23.181824 IP 192.168.1.105.43002 > 182.161.73.145.443: Flags [.], ack 243, win 501, options [nop,nop,TS val 2145350889 ecr 626821745], length 0
17:38:23.182380 IP 192.168.1.105.43002 > 182.161.73.145.443: Flags [P.], seq 1465:1549, ack 243, win 501, options [nop,nop,TS val 2145350889 ecr 626821745], length 84
17:38:23.184730 IP 192.168.1.105.43002 > 182.161.73.145.443: Flags [P.], seq 1549:1896, ack 243, win 501, options [nop,nop,TS val 2145350892 ecr 626821745], length 347
17:38:23.184852 IP 192.168.1.105.43002 > 182.161.73.145.443: Flags [P.], seq 1896:4648, ack 243, win 501, options [nop,nop,TS val 2145350892 ecr 626821745], length 2752
17:38:23.185123 IP 69.173.158.65.443 > 192.168.1.105.41672: Flags [P.], seq 1:140, ack 1295, win 5068, options [nop,nop,TS val 2368795199 ecr 2379307339], length 139
17:38:23.185136 IP 192.168.1.105.41672 > 69.173.158.65.443: Flags [.], ack 140, win 501, options [nop,nop,TS val 2379307466 ecr 2368795199], length 0
17:38:23.187493 IP 182.161.73.145.443 > 192.168.1.105.43002: Flags [.], ack 1465, win 63, options [nop,nop,TS val 626821745 ecr 2145350735], length 0
17:38:23.187504 IP 192.168.1.105.43002 > 182.161.73.145.443: Flags [.], ack 243, win 501, options [nop,nop,TS val 2145350894 ecr 626821745], length 0
17:38:23.189743 IP 69.173.158.65.443 > 192.168.1.105.41672: Flags [P.], seq 140:177, ack 1295, win 5792, options [nop,nop,TS val 2368795199 ecr 2379307339], length 37
17:38:23.189758 IP 192.168.1.105.41672 > 69.173.158.65.443: Flags [.], ack 177, win 501, options [nop,nop,TS val 2379307471 ecr 2368795199], length 0
17:38:23.189816 IP 69.173.158.65.443 > 192.168.1.105.41672: Flags [P.], seq 177:251, ack 1295, win 6516, options [nop,nop,TS val 2368795200 ecr 2379307339], length 74
17:38:23.189821 IP 192.168.1.105.41672 > 69.173.158.65.443: Flags [.], ack 251, win 501, options [nop,nop,TS val 2379307471 ecr 2368795200], length 0
17:38:23.190639 IP 192.168.1.105.41672 > 69.173.158.65.443: Flags [P.], seq 1295:1375, ack 251, win 501, options [nop,nop,TS val 2379307471 ecr 2368795200], length 80
17:38:23.191340 IP 192.168.1.105.41672 > 69.173.158.65.443: Flags [P.], seq 1375:1545, ack 251, win 501, options [nop,nop,TS val 2379307472 ecr 2368795200], length 170
17:38:23.191436 IP 192.168.1.105.41672 > 69.173.158.65.443: Flags [P.], seq 1545:3164, ack 251, win 501, options [nop,nop,TS val 2379307472 ecr 2368795200], length 1619
17:38:23.208364 IP 172.64.153.78.443 > 192.168.1.105.39530: Flags [P.], seq 1:518, ack 2529, win 16, options [nop,nop,TS val 952728344 ecr 2219226181], length 517
17:38:23.208384 IP 192.168.1.105.39530 > 172.64.153.78.443: Flags [.], ack 518, win 501, options [nop,nop,TS val 2219226482 ecr 952728344], length 0
17:38:23.208474 IP 172.64.153.78.443 > 192.168.1.105.39530: Flags [P.], seq 518:1108, ack 2529, win 16, options [nop,nop,TS val 952728344 ecr 2219226181], length 590
17:38:23.208492 IP 192.168.1.105.39530 > 172.64.153.78.443: Flags [.], ack 1108, win 501, options [nop,nop,TS val 2219226482 ecr 952728344], length 0
17:38:23.208524 IP 172.64.153.78.443 > 192.168.1.105.39530: Flags [P.], seq 1108:1139, ack 2529, win 16, options [nop,nop,TS val 952728344 ecr 2219226181], length 31
17:38:23.208527 IP 192.168.1.105.39530 > 172.64.153.78.443: Flags [.], ack 1139, win 501, options [nop,nop,TS val 2219226482 ecr 952728344], length 0
17:38:23.226281 IP 51.81.244.170.443 > 192.168.1.105.43608: Flags [.], ack 1246, win 83, options [nop,nop,TS val 3198349773 ecr 3149405452], length 0
17:38:23.244561 IP 192.168.1.105.51084 > 193.3.178.3.443: Flags [S], seq 3802998442, win 64240, options [mss 1460,sackOK,TS val 1095656418 ecr 0,nop,wscale 7], length 0
17:38:23.256945 IP 34.149.50.64.443 > 192.168.1.105.58712: Flags [.], ack 1754, win 396, options [nop,nop,TS val 2077682852 ecr 883617341], length 0
17:38:23.276668 IP 51.81.244.170.443 > 192.168.1.105.43608: Flags [.], ack 1966, win 83, options [nop,nop,TS val 3198349817 ecr 3149405452], length 0
17:38:23.305075 IP 103.43.90.179.443 > 192.168.1.105.52906: Flags [P.], seq 151:220, ack 920, win 83, options [nop,nop,TS val 1650453988 ecr 1793752048], length 69
17:38:23.305182 IP 192.168.1.105.52906 > 103.43.90.179.443: Flags [P.], seq 3186:3224, ack 220, win 501, options [nop,nop,TS val 1793752175 ecr 1650453988], length 38
17:38:23.308773 IP 103.43.90.179.443 > 192.168.1.105.52906: Flags [P.], seq 220:271, ack 1414, win 83, options [nop,nop,TS val 1650453990 ecr 1793752049], length 51
17:38:23.312799 IP 51.79.154.29.443 > 192.168.1.105.59896: Flags [P.], seq 243:295, ack 4690, win 80, options [nop,nop,TS val 26597323 ecr 2624226581], length 52
17:38:23.312815 IP 51.79.154.29.443 > 192.168.1.105.59896: Flags [P.], seq 295:343, ack 5187, win 83, options [nop,nop,TS val 26597324 ecr 2624226581], length 48
17:38:23.312817 IP 182.161.73.145.443 > 192.168.1.105.43002: Flags [P.], seq 243:307, ack 1896, win 63, options [nop,nop,TS val 626821875 ecr 2145350889], length 64
17:38:23.312819 IP 103.43.90.179.443 > 192.168.1.105.52906: Flags [.], ack 1414, win 83, options [nop,nop,TS val 1650453990 ecr 1793752049], length 0
17:38:23.312821 IP 51.79.154.29.443 > 192.168.1.105.59896: Flags [.], ack 1398, win 83, options [nop,nop,TS val 26597323 ecr 2624226576,nop,nop,sack 1 {1794:3242}], length 0
17:38:23.312823 IP 51.79.154.29.443 > 192.168.1.105.59896: Flags [.], ack 1398, win 83, options [nop,nop,TS val 26597323 ecr 2624226576,nop,nop,sack 1 {1794:4690}], length 0
17:38:23.312823 IP 51.79.154.29.443 > 192.168.1.105.59896: Flags [.], ack 1482, win 83, options [nop,nop,TS val 26597323 ecr 2624226578,nop,nop,sack 1 {1794:4690}], length 0
17:38:23.312824 IP 51.79.154.29.443 > 192.168.1.105.59896: Flags [.], ack 1482, win 83, options [nop,nop,TS val 26597323 ecr 2624226578,nop,nop,sack 1 {1794:4690}], length 0
17:38:23.312833 IP 51.79.154.29.443 > 192.168.1.105.59896: Flags [.], ack 4690, win 80, options [nop,nop,TS val 26597323 ecr 2624226581], length 0
17:38:23.312833 IP 51.79.154.29.443 > 192.168.1.105.59896: Flags [.], ack 5187, win 83, options [nop,nop,TS val 26597324 ecr 2624226581], length 0
17:38:23.312834 IP 103.43.90.179.443 > 192.168.1.105.52906: Flags [.], ack 1414, win 83, options [nop,nop,TS val 1650453994 ecr 1793752049,nop,nop,sack 1 {2862:3186}], length 0
17:38:23.312838 IP 69.173.158.65.443 > 192.168.1.105.41672: Flags [.], ack 1295, win 6516, options [nop,nop,TS val 2368795232 ecr 2379307466,nop,nop,sack 1 {1545:2993}], length 0
17:38:23.312841 IP 103.43.90.179.443 > 192.168.1.105.52906: Flags [.], ack 3186, win 82, options [nop,nop,TS val 1650453995 ecr 1793752049], length 0
17:38:23.312978 IP 192.168.1.105.43002 > 182.161.73.145.443: Flags [P.], seq 4648:4679, ack 307, win 501, options [nop,nop,TS val 2145351020 ecr 626821875], length 31
17:38:23.313154 IP 192.168.1.105.59896 > 51.79.154.29.443: Flags [P.], seq 5187:5218, ack 343, win 501, options [nop,nop,TS val 2624226715 ecr 26597323], length 31
17:38:23.313877 IP 103.43.90.179.443 > 192.168.1.105.52906: Flags [P.], seq 271:1006, ack 3186, win 83, options [nop,nop,TS val 1650453996 ecr 1793752049], length 735
17:38:23.313976 IP 192.168.1.105.52906 > 103.43.90.179.443: Flags [.], ack 1006, win 495, options [nop,nop,TS val 1793752184 ecr 1650453990], length 0
17:38:23.314473 IP 182.161.73.145.443 > 192.168.1.105.43002: Flags [P.], seq 307:355, ack 4648, win 63, options [nop,nop,TS val 626821879 ecr 2145350892], length 48
17:38:23.315810 IP 69.173.158.65.443 > 192.168.1.105.41672: Flags [.], ack 1375, win 6516, options [nop,nop,TS val 2368795233 ecr 2379307471,nop,nop,sack 1 {1545:2993}], length 0
17:38:23.315819 IP 69.173.158.65.443 > 192.168.1.105.41672: Flags [.], ack 2993, win 6516, options [nop,nop,TS val 2368795233 ecr 2379307472], length 0
17:38:23.315822 IP 182.161.73.145.443 > 192.168.1.105.43002: Flags [.], ack 4648, win 63, options [nop,nop,TS val 626821879 ecr 2145350892], length 0
17:38:23.318037 IP 69.173.158.65.443 > 192.168.1.105.41672: Flags [P.], seq 251:538, ack 3164, win 10136, options [nop,nop,TS val 2368795233 ecr 2379307472], length 287
17:38:23.321877 IP 69.173.158.65.443 > 192.168.1.105.41672: Flags [P.], seq 538:581, ack 3164, win 11584, options [nop,nop,TS val 2368795233 ecr 2379307472], length 43
17:38:23.321898 IP 69.173.158.65.443 > 192.168.1.105.41672: Flags [P.], seq 581:599, ack 3164, win 12308, options [nop,nop,TS val 2368795233 ecr 2379307472], length 18
17:38:23.321900 IP 69.173.158.65.443 > 192.168.1.105.41672: Flags [P.], seq 599:625, ack 3164, win 12308, options [nop,nop,TS val 2368795233 ecr 2379307472], length 26
17:38:23.321998 IP 192.168.1.105.41672 > 69.173.158.65.443: Flags [P.], seq 3164:3195, ack 625, win 501, options [nop,nop,TS val 2379307603 ecr 2368795233], length 31
17:38:23.336290 IP 52.204.201.175.443 > 192.168.1.105.34624: Flags [.], ack 912, win 224, options [nop,nop,TS val 425233311 ecr 1675399309], length 0
17:38:23.354757 IP 192.168.1.105.43002 > 182.161.73.145.443: Flags [.], ack 355, win 501, options [nop,nop,TS val 2145351062 ecr 626821879], length 0
17:38:23.362027 IP 51.81.244.170.443 > 192.168.1.105.43608: Flags [P.], seq 1:126, ack 1966, win 83, options [nop,nop,TS val 3198349917 ecr 3149405452], length 125
17:38:23.362069 IP 192.168.1.105.43608 > 51.81.244.170.443: Flags [.], ack 126, win 501, options [nop,nop,TS val 3149405895 ecr 3198349917], length 0
17:38:23.383911 IP 51.79.154.29.443 > 192.168.1.105.59896: Flags [P.], seq 343:778, ack 5187, win 83, options [nop,nop,TS val 26597398 ecr 2624226581], length 435
17:38:23.414736 IP 54.84.92.154.443 > 192.168.1.105.45354: Flags [P.], seq 1449:2414, ack 845, win 17, options [nop,nop,TS val 3977395972 ecr 1154371110], length 965
17:38:23.414761 IP 192.168.1.105.45354 > 54.84.92.154.443: Flags [.], ack 1, win 502, options [nop,nop,TS val 1154371372 ecr 3977395676,nop,nop,sack 1 {1449:2414}], length 0
17:38:23.414829 IP 69.173.158.65.443 > 192.168.1.105.41672: Flags [P.], seq 625:1143, ack 3164, win 13032, options [nop,nop,TS val 2368795257 ecr 2379307472], length 518
17:38:23.414846 IP 54.84.92.154.443 > 192.168.1.105.45354: Flags [.], seq 1:1449, ack 845, win 17, options [nop,nop,TS val 3977395972 ecr 1154371110], length 1448
17:38:23.414851 IP 192.168.1.105.45354 > 54.84.92.154.443: Flags [.], ack 2414, win 501, options [nop,nop,TS val 1154371372 ecr 3977395972], length 0
17:38:23.417640 IP 54.84.92.154.443 > 192.168.1.105.45354: Flags [.], ack 845, win 17, options [nop,nop,TS val 3977395971 ecr 1154371110], length 0
17:38:23.417662 IP 192.168.1.105.45354 > 54.84.92.154.443: Flags [.], ack 2414, win 501, options [nop,nop,TS val 1154371374 ecr 3977395972], length 0
17:38:23.417738 IP 69.173.158.65.443 > 192.168.1.105.41672: Flags [P.], seq 1143:1769, ack 3164, win 13032, options [nop,nop,TS val 2368795257 ecr 2379307472], length 626
17:38:23.417753 IP 69.173.158.65.443 > 192.168.1.105.41672: Flags [P.], seq 1769:1812, ack 3164, win 13032, options [nop,nop,TS val 2368795257 ecr 2379307472], length 43
