12:16:14.854288 IP 192.168.1.105.50571 > 192.178.24.132.443: UDP, length 1250
12:16:14.854822 IP 192.168.1.105.50571 > 192.178.24.132.443: UDP, length 77
12:16:14.900815 IP 192.168.1.105.43372 > 192.168.1.100.3306: Flags [S], seq 905461150, win 64240, options [mss 1460,sackOK,TS val 2329893773 ecr 0,nop,wscale 7], length 0
12:16:14.901326 IP 192.168.1.100.3306 > 192.168.1.105.43372: Flags [S.], seq 3159218689, ack 905461151, win 65535, options [mss 1460,nop,wscale 8,nop,nop,sackOK], length 0
12:16:14.901416 IP 192.168.1.105.43372 > 192.168.1.100.3306: Flags [.], ack 1, win 502, length 0
12:16:14.902524 IP 192.168.1.100.3306 > 192.168.1.105.43372: Flags [P.], seq 1:94, ack 1, win 4106, length 93
12:16:14.902553 IP 192.168.1.105.43372 > 192.168.1.100.3306: Flags [.], ack 94, win 502, length 0
12:16:14.903879 IP 192.168.1.105.43372 > 192.168.1.100.3306: Flags [P.], seq 1:99, ack 94, win 502, length 98
12:16:14.904598 IP 192.168.1.100.3306 > 192.168.1.105.43372: Flags [P.], seq 94:105, ack 99, win 4105, length 11
12:16:14.904924 IP 192.168.1.105.43372 > 192.168.1.100.3306: Flags [P.], seq 99:146, ack 105, win 502, length 47
12:16:14.905423 IP 192.168.1.100.3306 > 192.168.1.105.43372: Flags [P.], seq 105:116, ack 146, win 4105, length 11
12:16:14.905706 IP 192.168.1.105.43372 > 192.168.1.100.3306: Flags [P.], seq 146:181, ack 116, win 502, length 35
12:16:14.906134 IP 192.168.1.100.3306 > 192.168.1.105.43372: Flags [P.], seq 116:127, ack 181, win 4105, length 11
12:16:14.906423 IP 192.168.1.105.43372 > 192.168.1.100.3306: Flags [P.], seq 181:186, ack 127, win 502, length 5
12:16:14.906767 IP 192.168.1.100.3306 > 192.168.1.105.43372: Flags [P.], seq 127:138, ack 186, win 4105, length 11
12:16:14.913267 IP 192.168.1.105.43372 > 192.168.1.100.3306: Flags [P.], seq 186:468, ack 138, win 502, length 282
12:16:14.927932 IP 192.168.1.100.3306 > 192.168.1.105.43372: Flags [P.], seq 138:151, ack 468, win 4104, length 13
12:16:14.928249 IP 192.168.1.105.43372 > 192.168.1.100.3306: Flags [P.], seq 468:750, ack 151, win 502, length 282
12:16:14.928746 IP 192.168.1.100.3306 > 192.168.1.105.43372: Flags [P.], seq 151:164, ack 750, win 4103, length 13
12:16:14.929022 IP 192.168.1.105.43372 > 192.168.1.100.3306: Flags [P.], seq 750:1031, ack 164, win 502, length 281
12:16:14.929415 IP 192.168.1.100.3306 > 192.168.1.105.43372: Flags [P.], seq 164:177, ack 1031, win 4102, length 13
12:16:14.929571 IP 192.168.1.105.43372 > 192.168.1.100.3306: Flags [P.], seq 1031:1312, ack 177, win 502, length 281
12:16:14.929951 IP 192.168.1.100.3306 > 192.168.1.105.43372: Flags [P.], seq 177:190, ack 1312, win 4101, length 13
12:16:14.930117 IP 192.168.1.105.43372 > 192.168.1.100.3306: Flags [P.], seq 1312:1593, ack 190, win 502, length 281
12:16:14.930500 IP 192.168.1.100.3306 > 192.168.1.105.43372: Flags [P.], seq 190:203, ack 1593, win 4106, length 13
12:16:14.930692 IP 192.168.1.105.43372 > 192.168.1.100.3306: Flags [P.], seq 1593:1873, ack 203, win 502, length 280
12:16:14.931042 IP 192.168.1.100.3306 > 192.168.1.105.43372: Flags [P.], seq 203:216, ack 1873, win 4105, length 13
12:16:14.931185 IP 192.168.1.105.43372 > 192.168.1.100.3306: Flags [P.], seq 1873:2179, ack 216, win 502, length 306
12:16:14.931517 IP 192.168.1.100.3306 > 192.168.1.105.43372: Flags [P.], seq 216:229, ack 2179, win 4103, length 13
12:16:14.931657 IP 192.168.1.105.43372 > 192.168.1.100.3306: Flags [P.], seq 2179:2462, ack 229, win 502, length 283
12:16:14.931989 IP 192.168.1.100.3306 > 192.168.1.105.43372: Flags [P.], seq 229:242, ack 2462, win 4102, length 13
12:16:14.932131 IP 192.168.1.105.43372 > 192.168.1.100.3306: Flags [P.], seq 2462:2744, ack 242, win 502, length 282
12:16:14.932472 IP 192.168.1.100.3306 > 192.168.1.105.43372: Flags [P.], seq 242:255, ack 2744, win 4101, length 13
12:16:14.932611 IP 192.168.1.105.43372 > 192.168.1.100.3306: Flags [P.], seq 2744:3026, ack 255, win 502, length 282
12:16:14.932914 IP 192.168.1.100.3306 > 192.168.1.105.43372: Flags [P.], seq 255:268, ack 3026, win 4100, length 13
12:16:14.933058 IP 192.168.1.105.43372 > 192.168.1.100.3306: Flags [P.], seq 3026:3307, ack 268, win 502, length 281
12:16:14.933343 IP 192.168.1.100.3306 > 192.168.1.105.43372: Flags [P.], seq 268:281, ack 3307, win 4106, length 13
12:16:14.933457 IP 192.168.1.105.43372 > 192.168.1.100.3306: Flags [P.], seq 3307:3588, ack 281, win 502, length 281
12:16:14.933720 IP 192.168.1.100.3306 > 192.168.1.105.43372: Flags [P.], seq 281:294, ack 3588, win 4105, length 13
12:16:14.933819 IP 192.168.1.105.43372 > 192.168.1.100.3306: Flags [P.], seq 3588:3869, ack 294, win 502, length 281
12:16:14.934080 IP 192.168.1.100.3306 > 192.168.1.105.43372: Flags [P.], seq 294:307, ack 3869, win 4104, length 13
12:16:14.934170 IP 192.168.1.105.43372 > 192.168.1.100.3306: Flags [P.], seq 3869:4149, ack 307, win 502, length 280
12:16:14.934388 IP 192.168.1.100.3306 > 192.168.1.105.43372: Flags [P.], seq 307:320, ack 4149, win 4102, length 13
12:16:14.934531 IP 192.168.1.105.43372 > 192.168.1.100.3306: Flags [P.], seq 4149:4449, ack 320, win 502, length 300
12:16:14.934818 IP 192.168.1.100.3306 > 192.168.1.105.43372: Flags [P.], seq 320:333, ack 4449, win 4101, length 13
12:16:14.934922 IP 192.168.1.105.43372 > 192.168.1.100.3306: Flags [P.], seq 4449:4742, ack 333, win 502, length 293
12:16:14.935166 IP 192.168.1.100.3306 > 192.168.1.105.43372: Flags [P.], seq 333:346, ack 4742, win 4100, length 13
12:16:14.935259 IP 192.168.1.105.43372 > 192.168.1.100.3306: Flags [P.], seq 4742:5035, ack 346, win 502, length 293
12:16:14.935486 IP 192.168.1.100.3306 > 192.168.1.105.43372: Flags [P.], seq 346:359, ack 5035, win 4106, length 13
12:16:14.935575 IP 192.168.1.105.43372 > 192.168.1.100.3306: Flags [P.], seq 5035:5317, ack 359, win 502, length 282
12:16:14.935792 IP 192.168.1.100.3306 > 192.168.1.105.43372: Flags [P.], seq 359:372, ack 5317, win 4105, length 13
12:16:14.935902 IP 192.168.1.105.43372 > 192.168.1.100.3306: Flags [P.], seq 5317:5328, ack 372, win 502, length 11
12:16:14.955694 IP 192.178.24.132.443 > 192.168.1.105.50571: UDP, length 1250
12:16:14.968607 IP 192.168.1.100.3306 > 192.168.1.105.43372: Flags [P.], seq 372:383, ack 5328, win 4105, length 11
12:16:14.968788 IP 192.168.1.105.43372 > 192.168.1.100.3306: Flags [P.], seq 5328:5333, ack 383, win 502, length 5
12:16:14.968983 IP 192.168.1.105.43372 > 192.168.1.100.3306: Flags [F.], seq 5333, ack 383, win 502, length 0
12:16:14.969094 IP 192.168.1.100.3306 > 192.168.1.105.43372: Flags [F.], seq 383, ack 5333, win 4105, length 0
12:16:14.969106 IP 192.168.1.100.3306 > 192.168.1.105.43372: Flags [.], ack 5334, win 4105, length 0
12:16:14.969126 IP 192.168.1.105.43372 > 192.168.1.100.3306: Flags [.], ack 384, win 502, length 0
12:16:15.053036 IP 192.178.24.132.443 > 192.168.1.105.50571: UDP, length 1250
12:16:15.055535 IP 192.168.1.105.50571 > 192.178.24.132.443: UDP, length 1250
12:16:15.056208 IP 192.178.24.132.443 > 192.168.1.105.50571: UDP, length 306
12:16:15.057151 IP 192.168.1.105.50571 > 192.178.24.132.443: UDP, length 78
12:16:15.064730 IP 192.178.24.132.443 > 192.168.1.105.50571: UDP, length 942
12:16:15.065084 IP 192.168.1.105.50571 > 192.178.24.132.443: UDP, length 31
12:16:15.065582 IP 192.178.24.132.443 > 192.168.1.105.50571: UDP, length 25
12:16:15.135503 IP 192.178.24.132.443 > 192.168.1.105.50571: UDP, length 120
12:16:15.161557 IP 192.168.1.105.50571 > 192.178.24.132.443: UDP, length 32
12:16:15.517678 ARP, Request who-has 192.168.1.105 tell 192.168.1.1, length 46
12:16:15.517691 ARP, Reply 192.168.1.105 is-at 00:0c:29:af:d3:04, length 28
12:16:16.517789 ARP, Request who-has 192.168.1.105 tell 192.168.1.1, length 46
12:16:16.517799 ARP, Reply 192.168.1.105 is-at 00:0c:29:af:d3:04, length 28
12:16:17.517423 ARP, Request who-has 192.168.1.105 tell 192.168.1.1, length 46
12:16:17.517432 ARP, Reply 192.168.1.105 is-at 00:0c:29:af:d3:04, length 28
12:16:18.396347 IP 110.93.206.253.443 > 192.168.1.105.44310: Flags [P.], seq 591116:591249, ack 108911, win 259, options [nop,nop,TS val 116725756 ecr 3763987766], length 133
