10:16:14.415592 ARP, Request who-has 192.168.1.100 tell 192.168.1.1, length 46
10:16:14.458924 IP 34.107.243.93.443 > 192.168.1.105.47840: Flags [P.], seq 3683:3722, ack 978, win 262, options [nop,nop,TS val 2287055792 ecr 1477597531], length 39
10:16:14.458948 IP 192.168.1.105.47840 > 34.107.243.93.443: Flags [.], ack 3722, win 501, options [nop,nop,TS val 1477597621 ecr 2287055792], length 0
10:16:14.462046 IP 34.107.243.93.443 > 192.168.1.105.47840: Flags [.], ack 975, win 262, options [nop,nop,TS val 2287055792 ecr 1477597531], length 0
10:16:14.462060 IP 192.168.1.105.47840 > 34.107.243.93.443: Flags [.], ack 3722, win 501, options [nop,nop,TS val 1477597624 ecr 2287055792], length 0
10:16:14.462122 IP 34.107.243.93.443 > 192.168.1.105.47840: Flags [.], ack 978, win 262, options [nop,nop,TS val 2287055792 ecr 1477597531], length 0
10:16:15.049259 IP 192.168.1.105.47982 > 34.107.221.82.80: Flags [.], ack 299, win 501, options [nop,nop,TS val 2133896210 ecr 2214473008], length 0
10:16:15.049382 IP 192.168.1.105.47984 > 34.107.221.82.80: Flags [.], ack 217, win 501, options [nop,nop,TS val 2133896210 ecr 996848490], length 0
10:16:15.141975 IP 34.107.221.82.80 > 192.168.1.105.47982: Flags [.], ack 302, win 261, options [nop,nop,TS val 2214483268 ecr 2133841467], length 0
10:16:15.141989 IP 34.107.221.82.80 > 192.168.1.105.47984: Flags [.], ack 319, win 261, options [nop,nop,TS val 996858750 ecr 2133841591], length 0
10:16:15.413376 ARP, Request who-has 192.168.1.100 tell 192.168.1.1, length 46
10:16:16.068051 IP 192.168.1.105.52618 > 110.93.206.253.443: Flags [S], seq 1898338479, win 64240, options [mss 1460,sackOK,TS val 3730030242 ecr 0,nop,wscale 7], length 0
10:16:16.131184 IP 110.93.206.253.443 > 192.168.1.105.52618: Flags [S.], seq 3470181561, ack 1898338480, win 8192, options [mss 1200,nop,wscale 8,sackOK,TS val 107366261 ecr 3730030242], length 0
10:16:16.131211 IP 192.168.1.105.52618 > 110.93.206.253.443: Flags [.], ack 1, win 502, options [nop,nop,TS val 3730030306 ecr 107366261], length 0
10:16:16.134317 IP 192.168.1.105.52618 > 110.93.206.253.443: Flags [F.], seq 1, ack 1, win 502, options [nop,nop,TS val 3730030309 ecr 107366261], length 0
10:16:16.157140 IP 110.93.206.253.443 > 192.168.1.105.52618: Flags [R.], seq 1, ack 2, win 0, length 0
10:16:16.413431 ARP, Request who-has 192.168.1.100 tell 192.168.1.1, length 46
10:16:17.463683 IP 192.168.1.105.59206 > 34.149.100.209.443: Flags [P.], seq 1828:1974, ack 297680, win 3661, options [nop,nop,TS val 2199078590 ecr 2123455925], length 146
10:16:17.542334 IP 34.149.100.209.443 > 192.168.1.105.59206: Flags [.], ack 1974, win 301, options [nop,nop,TS val 2123467552 ecr 2199078590], length 0
10:16:17.543836 IP 34.149.100.209.443 > 192.168.1.105.59206: Flags [P.], seq 297680:297788, ack 1974, win 301, options [nop,nop,TS val 2123467553 ecr 2199078590], length 108
10:16:17.543849 IP 34.149.100.209.443 > 192.168.1.105.59206: Flags [P.], seq 297788:299188, ack 1974, win 301, options [nop,nop,TS val 2123467553 ecr 2199078590], length 1400
10:16:17.543858 IP 192.168.1.105.59206 > 34.149.100.209.443: Flags [.], ack 299188, win 3683, options [nop,nop,TS val 2199078670 ecr 2123467553], length 0
10:16:17.544215 IP 34.149.100.209.443 > 192.168.1.105.59206: Flags [P.], seq 299188:300588, ack 1974, win 301, options [nop,nop,TS val 2123467554 ecr 2199078590], length 1400
10:16:17.544222 IP 34.149.100.209.443 > 192.168.1.105.59206: Flags [P.], seq 300588:301363, ack 1974, win 301, options [nop,nop,TS val 2123467555 ecr 2199078590], length 775
10:16:17.544226 IP 192.168.1.105.59206 > 34.149.100.209.443: Flags [.], ack 301363, win 3726, options [nop,nop,TS val 2199078671 ecr 2123467554], length 0
10:16:17.544270 IP 34.149.100.209.443 > 192.168.1.105.59206: Flags [P.], seq 301363:301409, ack 1974, win 301, options [nop,nop,TS val 2123467555 ecr 2199078590], length 46
10:16:17.545397 IP 192.168.1.105.59206 > 34.149.100.209.443: Flags [P.], seq 1974:2020, ack 301409, win 3726, options [nop,nop,TS val 2199078672 ecr 2123467555], length 46
10:16:17.612294 IP 34.149.100.209.443 > 192.168.1.105.59206: Flags [.], ack 2020, win 301, options [nop,nop,TS val 2123467618 ecr 2199078672], length 0
10:16:19.509116 ARP, Request who-has 192.168.1.100 tell 192.168.1.1, length 46
10:16:23.092764 IP 192.168.1.105.48241 > 192.168.1.1.53: 31178+ A? mail.psca.gop.pk. (34)
10:16:23.092954 IP 192.168.1.105.33043 > 192.168.1.1.53: 1268+ AAAA? mail.psca.gop.pk. (34)
10:16:23.093305 IP 192.168.1.105.52634 > 110.93.206.253.443: Flags [S], seq 2063195715, win 64240, options [mss 1460,sackOK,TS val 3730037268 ecr 0,nop,wscale 7], length 0
10:16:23.093950 IP 192.168.1.105.47060 > 192.168.1.1.53: 1930+ Type65? mail.psca.gop.pk. (34)
10:16:23.096842 IP 192.168.1.1.53 > 192.168.1.105.48241: 31178 1/0/0 A 110.93.206.253 (50)
10:16:23.096863 IP 192.168.1.1.53 > 192.168.1.105.33043: 1268 0/0/0 (34)
10:16:23.147265 IP 110.93.206.253.443 > 192.168.1.105.52634: Flags [S.], seq 182538313, ack 2063195716, win 8192, options [mss 1200,nop,wscale 8,sackOK,TS val 107366963 ecr 3730037268], length 0
10:16:23.147316 IP 192.168.1.105.52634 > 110.93.206.253.443: Flags [.], ack 1, win 502, options [nop,nop,TS val 3730037322 ecr 107366963], length 0
10:16:23.147412 IP 192.168.1.1.53 > 192.168.1.105.47060: 1930 0/1/0 (96)
10:16:23.179416 IP 192.168.1.105.52634 > 110.93.206.253.443: Flags [P.], seq 1:665, ack 1, win 502, options [nop,nop,TS val 3730037354 ecr 107366963], length 664
10:16:23.216364 IP 192.168.1.105.42807 > 192.168.1.1.53: 49871+ A? detectportal.firefox.com. (42)
10:16:23.216552 IP 192.168.1.105.33445 > 192.168.1.1.53: 11926+ AAAA? detectportal.firefox.com. (42)
10:16:23.216850 IP 192.168.1.105.47982 > 34.107.221.82.80: Flags [P.], seq 302:603, ack 299, win 501, options [nop,nop,TS val 2133904377 ecr 2214483268], length 301: HTTP: GET /canonical.html HTTP/1.1
10:16:23.238621 IP 110.93.206.253.443 > 192.168.1.105.52634: Flags [.], seq 1:1189, ack 665, win 259, options [nop,nop,TS val 107366972 ecr 3730037354], length 1188
10:16:23.238652 IP 192.168.1.105.52634 > 110.93.206.253.443: Flags [.], ack 1189, win 501, options [nop,nop,TS val 3730037413 ecr 107366972], length 0
10:16:23.241231 IP 110.93.206.253.443 > 192.168.1.105.52634: Flags [.], seq 1189:3565, ack 665, win 259, options [nop,nop,TS val 107366972 ecr 3730037354], length 2376
10:16:23.241249 IP 192.168.1.105.52634 > 110.93.206.253.443: Flags [.], ack 3565, win 501, options [nop,nop,TS val 3730037416 ecr 107366972], length 0
10:16:23.241779 IP 110.93.206.253.443 > 192.168.1.105.52634: Flags [P.], seq 3565:4721, ack 665, win 259, options [nop,nop,TS val 107366972 ecr 3730037354], length 1156
10:16:23.241790 IP 192.168.1.105.52634 > 110.93.206.253.443: Flags [.], ack 4721, win 501, options [nop,nop,TS val 3730037416 ecr 107366972], length 0
10:16:23.273639 IP 192.168.1.1.53 > 192.168.1.105.42807: 49871 3/0/0 CNAME detectportal.prod.mozaws.net., CNAME prod.detectportal.prod.cloudops.mozgcp.net., A 34.107.221.82 (153)
10:16:23.273668 IP 192.168.1.1.53 > 192.168.1.105.33445: 11926 3/0/0 CNAME detectportal.prod.mozaws.net., CNAME prod.detectportal.prod.cloudops.mozgcp.net., AAAA 2600:1901:0:38d7:: (165)
10:16:23.302158 IP 34.107.221.82.80 > 192.168.1.105.47982: Flags [P.], seq 299:597, ack 603, win 265, options [nop,nop,TS val 2214491437 ecr 2133904377], length 298: HTTP: HTTP/1.1 200 OK
10:16:23.302183 IP 192.168.1.105.47982 > 34.107.221.82.80: Flags [.], ack 597, win 501, options [nop,nop,TS val 2133904463 ecr 2214491437], length 0
10:16:23.317313 IP 192.168.1.105.52634 > 110.93.206.253.443: Flags [P.], seq 665:815, ack 4721, win 501, options [nop,nop,TS val 3730037492 ecr 107366972], length 150
10:16:23.319925 IP 192.168.1.105.47984 > 34.107.221.82.80: Flags [P.], seq 319:637, ack 217, win 501, options [nop,nop,TS val 2133904480 ecr 996858750], length 318: HTTP: GET /success.txt?ipv4 HTTP/1.1
10:16:23.320785 IP 192.168.1.105.53925 > 192.168.1.1.53: 63264+ AAAA? ipv4only.arpa. (31)
10:16:23.325419 IP 192.168.1.1.53 > 192.168.1.105.53925: 63264 0/0/0 (31)
10:16:23.346943 IP 110.93.206.253.443 > 192.168.1.105.52634: Flags [P.], seq 4721:4796, ack 815, win 259, options [nop,nop,TS val 107366983 ecr 3730037492], length 75
10:16:23.346971 IP 192.168.1.105.52634 > 110.93.206.253.443: Flags [.], ack 4796, win 501, options [nop,nop,TS val 3730037521 ecr 107366983], length 0
10:16:23.373918 IP 34.107.221.82.80 > 192.168.1.105.47984: Flags [P.], seq 217:433, ack 637, win 265, options [nop,nop,TS val 996866992 ecr 2133904480], length 216: HTTP: HTTP/1.1 200 OK
10:16:23.373968 IP 192.168.1.105.47984 > 34.107.221.82.80: Flags [.], ack 433, win 501, options [nop,nop,TS val 2133904534 ecr 996866992], length 0
10:16:33.481274 IP 192.168.1.105.47984 > 34.107.221.82.80: Flags [.], ack 433, win 501, options [nop,nop,TS val 2133914642 ecr 996866992], length 0
10:16:33.481411 IP 192.168.1.105.47982 > 34.107.221.82.80: Flags [.], ack 597, win 501, options [nop,nop,TS val 2133914642 ecr 2214491437], length 0
10:16:33.481482 IP 192.168.1.105.52634 > 110.93.206.253.443: Flags [.], ack 4796, win 501, options [nop,nop,TS val 3730047656 ecr 107366983], length 0
10:16:33.520799 IP 110.93.206.253.443 > 192.168.1.105.52634: Flags [.], ack 815, win 259, options [nop,nop,TS val 107368000 ecr 3730037521], length 0
10:16:33.541105 IP 34.107.221.82.80 > 192.168.1.105.47982: Flags [.], ack 603, win 265, options [nop,nop,TS val 2214501678 ecr 2133904463], length 0
10:16:33.550721 IP 34.107.221.82.80 > 192.168.1.105.47984: Flags [.], ack 637, win 265, options [nop,nop,TS val 996877160 ecr 2133904534], length 0
10:16:36.770936 IP 192.168.1.105.52634 > 110.93.206.253.443: Flags [P.], seq 815:2004, ack 4796, win 501, options [nop,nop,TS val 3730050945 ecr 107368000], length 1189
10:16:36.845560 IP 110.93.206.253.443 > 192.168.1.105.52634: Flags [.], ack 2004, win 259, options [nop,nop,TS val 107368333 ecr 3730050945], length 0
10:16:36.863905 IP 110.93.206.253.443 > 192.168.1.105.52634: Flags [.], seq 4796:5984, ack 2004, win 259, options [nop,nop,TS val 107368333 ecr 3730050945], length 1188
10:16:36.874507 IP 110.93.206.253.443 > 192.168.1.105.52634: Flags [.], seq 5984:7172, ack 2004, win 259, options [nop,nop,TS val 107368333 ecr 3730050945], length 1188
10:16:36.881217 IP 192.168.1.105.52634 > 110.93.206.253.443: Flags [P.], seq 2003:2004, ack 4796, win 501, options [nop,nop,TS val 3730051056 ecr 107368000], length 1
10:16:36.885253 IP 110.93.206.253.443 > 192.168.1.105.52634: Flags [.], seq 7172:8360, ack 2004, win 259, options [nop,nop,TS val 107368333 ecr 3730050945], length 1188
10:16:36.895519 IP 110.93.206.253.443 > 192.168.1.105.52634: Flags [.], seq 8360:9548, ack 2004, win 259, options [nop,nop,TS val 107368333 ecr 3730050945], length 1188
10:16:36.907094 IP 110.93.206.253.443 > 192.168.1.105.52634: Flags [.], seq 9548:10736, ack 2004, win 259, options [nop,nop,TS val 107368333 ecr 3730050945], length 1188
10:16:36.917140 IP 110.93.206.253.443 > 192.168.1.105.52634: Flags [.], seq 10736:11924, ack 2004, win 259, options [nop,nop,TS val 107368333 ecr 3730050945], length 1188
10:16:36.927796 IP 110.93.206.253.443 > 192.168.1.105.52634: Flags [.], seq 11924:13112, ack 2004, win 259, options [nop,nop,TS val 107368333 ecr 3730050945], length 1188
10:16:36.938500 IP 110.93.206.253.443 > 192.168.1.105.52634: Flags [.], seq 13112:14300, ack 2004, win 259, options [nop,nop,TS val 107368333 ecr 3730050945], length 1188
10:16:36.942428 IP 110.93.206.253.443 > 192.168.1.105.52634: Flags [.], ack 2004, win 259, options [nop,nop,TS val 107368341 ecr 3730050945,nop,nop,sack 1 {2003:2004}], length 0
10:16:37.137366 IP 192.168.1.105.52634 > 110.93.206.253.443: Flags [.], seq 815:2003, ack 4796, win 501, options [nop,nop,TS val 3730051312 ecr 107368000], length 1188
10:16:37.163817 IP 110.93.206.253.443 > 192.168.1.105.52634: Flags [.], seq 4796:5984, ack 2004, win 259, options [nop,nop,TS val 107368364 ecr 3730050945], length 1188
10:16:37.649398 IP 192.168.1.105.52634 > 110.93.206.253.443: Flags [.], seq 815:2003, ack 4796, win 501, options [nop,nop,TS val 3730051824 ecr 107368000], length 1188
10:16:37.771618 IP 110.93.206.253.443 > 192.168.1.105.52634: Flags [.], seq 4796:5984, ack 2004, win 259, options [nop,nop,TS val 107368425 ecr 3730050945], length 1188
10:16:38.665780 IP 192.168.1.105.52634 > 110.93.206.253.443: Flags [.], seq 815:2003, ack 4796, win 501, options [nop,nop,TS val 3730052840 ecr 107368000], length 1188
10:16:38.724276 IP 110.93.206.253.443 > 192.168.1.105.52634: Flags [.], ack 2004, win 259, options [nop,nop,TS val 107368521 ecr 3730050945,nop,nop,sack 1 {815:2003}], length 0
10:16:38.986457 IP 110.93.206.253.443 > 192.168.1.105.52634: Flags [.], seq 4796:5320, ack 2004, win 259, options [nop,nop,TS val 107368546 ecr 3730050945], length 524
10:16:40.198178 IP 110.93.206.253.443 > 192.168.1.105.52634: Flags [.], seq 4796:5320, ack 2004, win 259, options [nop,nop,TS val 107368667 ecr 3730050945], length 524
10:16:40.713238 IP 192.168.1.105.52634 > 110.93.206.253.443: Flags [.], seq 815:2003, ack 4796, win 501, options [nop,nop,TS val 3730054888 ecr 107368000], length 1188
10:16:40.788437 IP 110.93.206.253.443 > 192.168.1.105.52634: Flags [.], ack 2004, win 259, options [nop,nop,TS val 107368727 ecr 3730050945,nop,nop,sack 1 {815:2003}], length 0
10:16:41.420537 IP 110.93.206.253.443 > 192.168.1.105.52634: Flags [.], seq 4796:5984, ack 2004, win 259, options [nop,nop,TS val 107368788 ecr 3730050945], length 1188
10:16:41.851037 ARP, Request who-has 192.168.1.105 tell 192.168.1.1, length 46
10:16:41.851046 ARP, Reply 192.168.1.105 is-at 00:0c:29:af:d3:04, length 28
10:16:42.850625 ARP, Request who-has 192.168.1.105 tell 192.168.1.1, length 46
10:16:42.850636 ARP, Reply 192.168.1.105 is-at 00:0c:29:af:d3:04, length 28
10:16:43.721395 IP 192.168.1.105.47984 > 34.107.221.82.80: Flags [.], ack 433, win 501, options [nop,nop,TS val 2133924882 ecr 996877160], length 0
10:16:43.721548 IP 192.168.1.105.47982 > 34.107.221.82.80: Flags [.], ack 597, win 501, options [nop,nop,TS val 2133924882 ecr 2214501678], length 0
10:16:43.779731 IP 34.107.221.82.80 > 192.168.1.105.47982: Flags [.], ack 603, win 265, options [nop,nop,TS val 2214511913 ecr 2133904463], length 0
10:16:43.779746 IP 34.107.221.82.80 > 192.168.1.105.47984: Flags [.], ack 637, win 265, options [nop,nop,TS val 996887395 ecr 2133904534], length 0
10:16:43.812693 IP 110.93.206.253.443 > 192.168.1.105.52634: Flags [.], seq 4796:5984, ack 2004, win 259, options [nop,nop,TS val 107369029 ecr 3730050945], length 1188
10:16:43.850455 ARP, Request who-has 192.168.1.105 tell 192.168.1.1, length 46
10:16:43.850467 ARP, Reply 192.168.1.105 is-at 00:0c:29:af:d3:04, length 28
10:16:44.809351 IP 192.168.1.105.52634 > 110.93.206.253.443: Flags [.], seq 815:2003, ack 4796, win 501, options [nop,nop,TS val 3730058984 ecr 107368000], length 1188
10:16:44.889526 ARP, Request who-has 192.168.1.105 tell 192.168.1.1, length 46
10:16:44.889539 ARP, Reply 192.168.1.105 is-at 00:0c:29:af:d3:04, length 28
10:16:44.899604 IP 110.93.206.253.443 > 192.168.1.105.52634: Flags [.], ack 2004, win 259, options [nop,nop,TS val 107369137 ecr 3730050945,nop,nop,sack 1 {815:2003}], length 0
10:16:48.832598 IP 110.93.206.253.443 > 192.168.1.105.52634: Flags [.], seq 4796:5984, ack 2004, win 259, options [nop,nop,TS val 107369510 ecr 3730050945], length 1188
10:16:48.832649 IP 192.168.1.105.52634 > 110.93.206.253.443: Flags [.], ack 5984, win 501, options [nop,nop,TS val 3730063007 ecr 107369510], length 0
10:16:48.858007 IP 110.93.206.253.443 > 192.168.1.105.52634: Flags [.], seq 14300:16676, ack 2004, win 259, options [nop,nop,TS val 107369534 ecr 3730063007], length 2376
10:16:48.858031 IP 192.168.1.105.52634 > 110.93.206.253.443: Flags [.], ack 5984, win 501, options [nop,nop,TS val 3730063032 ecr 107369510,nop,nop,sack 1 {14300:16676}], length 0
10:16:48.886814 IP 110.93.206.253.443 > 192.168.1.105.52634: Flags [.], seq 5984:8360, ack 2004, win 259, options [nop,nop,TS val 107369537 ecr 3730063032], length 2376
10:16:48.886862 IP 192.168.1.105.52634 > 110.93.206.253.443: Flags [.], ack 8360, win 501, options [nop,nop,TS val 3730063061 ecr 107369537,nop,nop,sack 1 {14300:16676}], length 0
10:16:48.887280 IP 110.93.206.253.443 > 192.168.1.105.52634: Flags [.], seq 8360:9548, ack 2004, win 259, options [nop,nop,TS val 107369537 ecr 3730063032], length 1188
10:16:48.887290 IP 192.168.1.105.52634 > 110.93.206.253.443: Flags [.], ack 9548, win 501, options [nop,nop,TS val 3730063062 ecr 107369537,nop,nop,sack 1 {14300:16676}], length 0
10:16:48.920655 IP 110.93.206.253.443 > 192.168.1.105.52634: Flags [.], seq 9548:11924, ack 2004, win 259, options [nop,nop,TS val 107369540 ecr 3730063061], length 2376
10:16:48.920701 IP 192.168.1.105.52634 > 110.93.206.253.443: Flags [.], ack 11924, win 501, options [nop,nop,TS val 3730063095 ecr 107369540,nop,nop,sack 1 {14300:16676}], length 0
10:16:48.920770 IP 110.93.206.253.443 > 192.168.1.105.52634: Flags [.], seq 11924:13112, ack 2004, win 259, options [nop,nop,TS val 107369540 ecr 3730063062], length 1188
10:16:48.920779 IP 192.168.1.105.52634 > 110.93.206.253.443: Flags [.], ack 13112, win 501, options [nop,nop,TS val 3730063095 ecr 107369540,nop,nop,sack 1 {14300:16676}], length 0
10:16:48.945606 IP 110.93.206.253.443 > 192.168.1.105.52634: Flags [.], seq 13112:14300, ack 2004, win 259, options [nop,nop,TS val 107369543 ecr 3730063095], length 1188
10:16:48.945659 IP 192.168.1.105.52634 > 110.93.206.253.443: Flags [.], ack 16676, win 501, options [nop,nop,TS val 3730063120 ecr 107369543], length 0
10:16:48.987818 IP 110.93.206.253.443 > 192.168.1.105.52634: Flags [.], seq 16676:19052, ack 2004, win 259, options [nop,nop,TS val 107369546 ecr 3730063120], length 2376
10:16:48.987859 IP 192.168.1.105.52634 > 110.93.206.253.443: Flags [.], ack 19052, win 501, options [nop,nop,TS val 3730063162 ecr 107369546], length 0
10:16:48.988318 IP 110.93.206.253.443 > 192.168.1.105.52634: Flags [.], seq 19052:22616, ack 2004, win 259, options [nop,nop,TS val 107369546 ecr 3730063120], length 3564
10:16:48.988359 IP 192.168.1.105.52634 > 110.93.206.253.443: Flags [.], ack 22616, win 501, options [nop,nop,TS val 3730063163 ecr 107369546], length 0
10:16:49.025623 IP 110.93.206.253.443 > 192.168.1.105.52634: Flags [.], seq 22616:29744, ack 2004, win 259, options [nop,nop,TS val 107369550 ecr 3730063163], length 7128
10:16:49.025673 IP 192.168.1.105.52634 > 110.93.206.253.443: Flags [.], ack 29744, win 501, options [nop,nop,TS val 3730063200 ecr 107369550], length 0
10:16:49.056833 IP 110.93.206.253.443 > 192.168.1.105.52634: Flags [.], seq 29744:32120, ack 2004, win 259, options [nop,nop,TS val 107369554 ecr 3730063200], length 2376
10:16:49.056872 IP 192.168.1.105.52634 > 110.93.206.253.443: Flags [.], ack 32120, win 501, options [nop,nop,TS val 3730063231 ecr 107369554], length 0
10:16:49.057551 IP 110.93.206.253.443 > 192.168.1.105.52634: Flags [.], seq 32120:36872, ack 2004, win 259, options [nop,nop,TS val 107369554 ecr 3730063200], length 4752
10:16:49.057575 IP 192.168.1.105.52634 > 110.93.206.253.443: Flags [.], ack 36872, win 501, options [nop,nop,TS val 3730063232 ecr 107369554], length 0
10:16:49.082695 IP 110.93.206.253.443 > 192.168.1.105.52634: Flags [.], seq 36872:39248, ack 2004, win 259, options [nop,nop,TS val 107369557 ecr 3730063231], length 2376
10:16:49.082729 IP 192.168.1.105.52634 > 110.93.206.253.443: Flags [.], ack 39248, win 501, options [nop,nop,TS val 3730063257 ecr 107369557], length 0
10:16:49.083218 IP 110.93.206.253.443 > 192.168.1.105.52634: Flags [.], seq 39248:40436, ack 2004, win 259, options [nop,nop,TS val 107369557 ecr 3730063231], length 1188
10:16:49.083240 IP 192.168.1.105.52634 > 110.93.206.253.443: Flags [.], ack 40436, win 501, options [nop,nop,TS val 3730063258 ecr 107369557], length 0
10:16:49.086603 IP 110.93.206.253.443 > 192.168.1.105.52634: Flags [.], seq 40436:45188, ack 2004, win 259, options [nop,nop,TS val 107369557 ecr 3730063232], length 4752
10:16:49.086639 IP 192.168.1.105.52634 > 110.93.206.253.443: Flags [.], ack 45188, win 501, options [nop,nop,TS val 3730063261 ecr 107369557], length 0
10:16:49.118382 IP 110.93.206.253.443 > 192.168.1.105.52634: Flags [.], seq 45188:49940, ack 2004, win 259, options [nop,nop,TS val 107369559 ecr 3730063258], length 4752
10:16:49.118430 IP 192.168.1.105.52634 > 110.93.206.253.443: Flags [.], ack 49940, win 501, options [nop,nop,TS val 3730063293 ecr 107369559], length 0
10:16:49.118534 IP 110.93.206.253.443 > 192.168.1.105.52634: Flags [.], seq 49940:51128, ack 2004, win 259, options [nop,nop,TS val 107369559 ecr 3730063261], length 1188
10:16:49.118576 IP 110.93.206.253.443 > 192.168.1.105.52634: Flags [.], seq 51128:53504, ack 2004, win 259, options [nop,nop,TS val 107369559 ecr 3730063261], length 2376
10:16:49.118584 IP 192.168.1.105.52634 > 110.93.206.253.443: Flags [.], ack 53504, win 501, options [nop,nop,TS val 3730063293 ecr 107369559], length 0
10:16:49.119228 IP 110.93.206.253.443 > 192.168.1.105.52634: Flags [.], seq 53504:54692, ack 2004, win 259, options [nop,nop,TS val 107369559 ecr 3730063261], length 1188
10:16:49.160468 IP 192.168.1.105.52634 > 110.93.206.253.443: Flags [.], ack 54692, win 501, options [nop,nop,TS val 3730063335 ecr 107369559], length 0
10:16:49.161777 IP 110.93.206.253.443 > 192.168.1.105.52634: Flags [.], seq 54692:63008, ack 2004, win 259, options [nop,nop,TS val 107369563 ecr 3730063293], length 8316
10:16:49.161913 IP 192.168.1.105.52634 > 110.93.206.253.443: Flags [.], ack 63008, win 501, options [nop,nop,TS val 3730063336 ecr 107369563], length 0
10:16:49.162288 IP 110.93.206.253.443 > 192.168.1.105.52634: Flags [.], seq 63008:64196, ack 2004, win 259, options [nop,nop,TS val 107369563 ecr 3730063293], length 1188
10:16:49.162311 IP 192.168.1.105.52634 > 110.93.206.253.443: Flags [.], ack 64196, win 524, options [nop,nop,TS val 3730063337 ecr 107369563], length 0
10:16:49.191225 IP 110.93.206.253.443 > 192.168.1.105.52634: Flags [.], seq 64196:65384, ack 2004, win 259, options [nop,nop,TS val 107369567 ecr 3730063335], length 1188
10:16:49.191267 IP 192.168.1.105.52634 > 110.93.206.253.443: Flags [.], ack 65384, win 546, options [nop,nop,TS val 3730063366 ecr 107369567], length 0
10:16:49.199720 IP 110.93.206.253.443 > 192.168.1.105.52634: Flags [.], seq 65384:67760, ack 2004, win 259, options [nop,nop,TS val 107369568 ecr 3730063336], length 2376
10:16:49.199762 IP 192.168.1.105.52634 > 110.93.206.253.443: Flags [.], ack 67760, win 584, options [nop,nop,TS val 3730063374 ecr 107369568], length 0
10:16:49.200832 IP 110.93.206.253.443 > 192.168.1.105.52634: Flags [P.], seq 67760:73700, ack 2004, win 259, options [nop,nop,TS val 107369568 ecr 3730063336], length 5940
10:16:49.200878 IP 192.168.1.105.52634 > 110.93.206.253.443: Flags [.], ack 73700, win 676, options [nop,nop,TS val 3730063375 ecr 107369568], length 0
10:16:49.200966 IP 110.93.206.253.443 > 192.168.1.105.52634: Flags [.], seq 73700:74888, ack 2004, win 259, options [nop,nop,TS val 107369568 ecr 3730063337], length 1188
10:16:49.200978 IP 192.168.1.105.52634 > 110.93.206.253.443: Flags [.], ack 74888, win 699, options [nop,nop,TS val 3730063375 ecr 107369568], length 0
10:16:49.201065 IP 110.93.206.253.443 > 192.168.1.105.52634: Flags [.], seq 74888:76076, ack 2004, win 259, options [nop,nop,TS val 107369568 ecr 3730063337], length 1188
10:16:49.201079 IP 192.168.1.105.52634 > 110.93.206.253.443: Flags [.], ack 76076, win 722, options [nop,nop,TS val 3730063375 ecr 107369568], length 0
10:16:49.216503 IP 110.93.206.253.443 > 192.168.1.105.52634: Flags [.], seq 76076:77264, ack 2004, win 259, options [nop,nop,TS val 107369570 ecr 3730063366], length 1188
10:16:49.216546 IP 192.168.1.105.52634 > 110.93.206.253.443: Flags [.], ack 77264, win 744, options [nop,nop,TS val 3730063391 ecr 107369570], length 0
10:16:49.231138 IP 110.93.206.253.443 > 192.168.1.105.52634: Flags [.], seq 77264:79640, ack 2004, win 259, options [nop,nop,TS val 107369571 ecr 3730063374], length 2376
10:16:49.231205 IP 192.168.1.105.52634 > 110.93.206.253.443: Flags [.], ack 79640, win 781, options [nop,nop,TS val 3730063406 ecr 107369571], length 0
10:16:49.231313 IP 110.93.206.253.443 > 192.168.1.105.52634: Flags [.], seq 79640:80828, ack 2004, win 259, options [nop,nop,TS val 107369571 ecr 3730063375], length 1188
10:16:49.231330 IP 192.168.1.105.52634 > 110.93.206.253.443: Flags [.], ack 80828, win 804, options [nop,nop,TS val 3730063406 ecr 107369571], length 0
10:16:49.233861 IP 110.93.206.253.443 > 192.168.1.105.52634: Flags [P.], seq 80828:80837, ack 2004, win 259, options [nop,nop,TS val 107369571 ecr 3730063375], length 9
10:16:49.234014 IP 192.168.1.105.52634 > 110.93.206.253.443: Flags [.], ack 80837, win 804, options [nop,nop,TS val 3730063408 ecr 107369571], length 0
10:16:49.750826 IP 192.168.1.105.52634 > 110.93.206.253.443: Flags [P.], seq 2004:3065, ack 80837, win 804, options [nop,nop,TS val 3730063925 ecr 107369571], length 1061
10:16:49.766810 IP 192.168.1.105.48640 > 110.93.206.253.443: Flags [S], seq 3975389455, win 64240, options [mss 1460,sackOK,TS val 3730063941 ecr 0,nop,wscale 7], length 0
10:16:49.771402 IP 192.168.1.105.52634 > 110.93.206.253.443: Flags [P.], seq 3065:3118, ack 80837, win 804, options [nop,nop,TS val 3730063946 ecr 107369571], length 53
10:16:49.771915 IP 192.168.1.105.52634 > 110.93.206.253.443: Flags [F.], seq 3118, ack 80837, win 804, options [nop,nop,TS val 3730063946 ecr 107369571], length 0
10:16:49.789326 IP 110.93.206.253.443 > 192.168.1.105.52634: Flags [.], seq 80837:82025, ack 3065, win 255, options [nop,nop,TS val 107369627 ecr 3730063925], length 1188
10:16:49.789380 IP 192.168.1.105.52634 > 110.93.206.253.443: Flags [R], seq 2063198780, win 0, length 0
10:16:49.789502 IP 110.93.206.253.443 > 192.168.1.105.52634: Flags [.], seq 82025:83213, ack 3065, win 255, options [nop,nop,TS val 107369627 ecr 3730063925], length 1188
10:16:49.789575 IP 192.168.1.105.52634 > 110.93.206.253.443: Flags [R], seq 2063198780, win 0, length 0
10:16:49.790129 IP 110.93.206.253.443 > 192.168.1.105.52634: Flags [.], seq 83213:84401, ack 3065, win 255, options [nop,nop,TS val 107369627 ecr 3730063925], length 1188
10:16:49.790148 IP 192.168.1.105.52634 > 110.93.206.253.443: Flags [R], seq 2063198780, win 0, length 0
10:16:49.793123 IP 110.93.206.253.443 > 192.168.1.105.52634: Flags [.], seq 84401:86777, ack 3065, win 255, options [nop,nop,TS val 107369627 ecr 3730063925], length 2376
10:16:49.793148 IP 192.168.1.105.52634 > 110.93.206.253.443: Flags [R], seq 2063198780, win 0, length 0
10:16:49.794517 IP 110.93.206.253.443 > 192.168.1.105.48640: Flags [S.], seq 3481066652, ack 3975389456, win 8192, options [mss 1200,nop,wscale 8,sackOK,TS val 107369628 ecr 3730063941], length 0
10:16:49.794557 IP 192.168.1.105.48640 > 110.93.206.253.443: Flags [.], ack 1, win 502, options [nop,nop,TS val 3730063969 ecr 107369628], length 0
10:16:49.794649 IP 110.93.206.253.443 > 192.168.1.105.52634: Flags [.], seq 86777:93905, ack 3065, win 255, options [nop,nop,TS val 107369627 ecr 3730063925], length 7128
10:16:49.794665 IP 192.168.1.105.52634 > 110.93.206.253.443: Flags [R], seq 2063198780, win 0, length 0
10:16:49.795866 IP 192.168.1.105.48640 > 110.93.206.253.443: Flags [P.], seq 1:665, ack 1, win 502, options [nop,nop,TS val 3730063970 ecr 107369628], length 664
10:16:49.800234 IP 110.93.206.253.443 > 192.168.1.105.52634: Flags [.], ack 3065, win 255, options [nop,nop,TS val 107369628 ecr 3730063925], length 0
10:16:49.800258 IP 192.168.1.105.52634 > 110.93.206.253.443: Flags [R], seq 2063198780, win 0, length 0
10:16:49.814319 IP 192.168.1.105.48640 > 110.93.206.253.443: Flags [F.], seq 665, ack 1, win 502, options [nop,nop,TS val 3730063989 ecr 107369628], length 0
10:16:49.822975 IP 110.93.206.253.443 > 192.168.1.105.52634: Flags [.], ack 3119, win 255, options [nop,nop,TS val 107369630 ecr 3730063946], length 0
10:16:49.823000 IP 192.168.1.105.52634 > 110.93.206.253.443: Flags [R], seq 2063198834, win 0, length 0
10:16:49.837106 IP 110.93.206.253.443 > 192.168.1.105.48640: Flags [.], seq 1:2377, ack 665, win 259, options [nop,nop,TS val 107369632 ecr 3730063970], length 2376
10:16:49.837147 IP 192.168.1.105.48640 > 110.93.206.253.443: Flags [R], seq 3975390120, win 0, length 0
10:16:49.837976 IP 110.93.206.253.443 > 192.168.1.105.48640: Flags [.], seq 2377:3565, ack 665, win 259, options [nop,nop,TS val 107369632 ecr 3730063970], length 1188
10:16:49.838000 IP 192.168.1.105.48640 > 110.93.206.253.443: Flags [R], seq 3975390120, win 0, length 0
10:16:49.842001 IP 110.93.206.253.443 > 192.168.1.105.48640: Flags [P.], seq 3565:4721, ack 665, win 259, options [nop,nop,TS val 107369632 ecr 3730063970], length 1156
10:16:49.842026 IP 192.168.1.105.48640 > 110.93.206.253.443: Flags [R], seq 3975390120, win 0, length 0
10:16:49.842113 IP 110.93.206.253.443 > 192.168.1.105.48640: Flags [R.], seq 4721, ack 666, win 0, length 0
10:16:53.962204 IP 192.168.1.105.47984 > 34.107.221.82.80: Flags [.], ack 433, win 501, options [nop,nop,TS val 2133935123 ecr 996887395], length 0
10:16:53.962345 IP 192.168.1.105.47982 > 34.107.221.82.80: Flags [.], ack 597, win 501, options [nop,nop,TS val 2133935123 ecr 2214511913], length 0
10:16:54.058293 IP 34.107.221.82.80 > 192.168.1.105.47984: Flags [.], ack 637, win 265, options [nop,nop,TS val 996897670 ecr 2133904534], length 0
10:16:54.058308 IP 34.107.221.82.80 > 192.168.1.105.47982: Flags [.], ack 603, win 265, options [nop,nop,TS val 2214522188 ecr 2133904463], length 0
10:17:04.111223 IP 192.168.1.1.53 > 192.168.1.100.59540: 55173 0/1/0 (133)
10:17:04.115166 IP 192.168.1.1.53 > 192.168.1.100.65022: 10533 8/0/0 A 3.229.59.141, A 35.170.25.71, A 3.218.78.251, A 174.129.252.229, A 54.210.62.3, A 54.82.179.113, A 18.205.175.205, A 54.85.24.162 (174)
10:17:04.117056 IP 192.168.1.1.53 > 192.168.1.100.55509: 7781 0/1/0 (133)
10:17:04.201488 IP 192.168.1.105.47984 > 34.107.221.82.80: Flags [.], ack 433, win 501, options [nop,nop,TS val 2133945362 ecr 996897670], length 0
10:17:04.201648 IP 192.168.1.105.47982 > 34.107.221.82.80: Flags [.], ack 597, win 501, options [nop,nop,TS val 2133945362 ecr 2214522188], length 0
10:17:04.267269 IP 34.107.221.82.80 > 192.168.1.105.47982: Flags [.], ack 603, win 265, options [nop,nop,TS val 2214532408 ecr 2133904463], length 0
10:17:04.267286 IP 34.107.221.82.80 > 192.168.1.105.47984: Flags [.], ack 637, win 265, options [nop,nop,TS val 996907889 ecr 2133904534], length 0
10:17:04.344930 IP 3.226.60.7.443 > 192.168.1.100.59401: Flags [.], ack 2595676794, win 128, length 0
10:17:04.353104 IP 3.229.59.141.443 > 192.168.1.100.59467: Flags [S.], seq 3760250744, ack 2032234704, win 26883, options [mss 1460,nop,nop,sackOK,nop,wscale 8], length 0
10:17:04.599692 IP 3.229.59.141.443 > 192.168.1.100.59467: Flags [.], ack 1461, win 176, length 0
10:17:04.600574 IP 3.229.59.141.443 > 192.168.1.100.59467: Flags [.], ack 1876, win 187, length 0
10:17:04.613211 IP 3.229.59.141.443 > 192.168.1.100.59467: Flags [.], seq 1:1461, ack 1876, win 187, length 1460
10:17:04.625929 IP 3.229.59.141.443 > 192.168.1.100.59467: Flags [.], seq 1461:2921, ack 1876, win 187, length 1460
10:17:04.638672 IP 3.229.59.141.443 > 192.168.1.100.59467: Flags [.], seq 2921:4381, ack 1876, win 187, length 1460
10:17:04.651382 IP 3.229.59.141.443 > 192.168.1.100.59467: Flags [.], seq 4381:5841, ack 1876, win 187, length 1460
10:17:04.653708 IP 3.229.59.141.443 > 192.168.1.100.59467: Flags [P.], seq 5841:6037, ack 1876, win 187, length 196
10:17:04.659643 IP 3.229.59.141.443 > 192.168.1.100.59468: Flags [S.], seq 2297578575, ack 3573902225, win 26883, options [mss 1460,nop,nop,sackOK,nop,wscale 8], length 0
10:17:04.895297 IP 3.229.59.141.443 > 192.168.1.100.59467: Flags [.], ack 2443, win 198, length 0
10:17:04.896297 IP 3.229.59.141.443 > 192.168.1.100.59467: Flags [.], ack 5288, win 338, length 0
10:17:04.900692 IP 3.229.59.141.443 > 192.168.1.100.59467: Flags [P.], seq 6037:6208, ack 5288, win 338, length 171
10:17:04.902154 IP 3.229.59.141.443 > 192.168.1.100.59467: Flags [P.], seq 6208:6286, ack 5288, win 338, length 78
10:17:04.905819 IP 3.229.59.141.443 > 192.168.1.100.59467: Flags [P.], seq 6286:6654, ack 5288, win 338, length 368
10:17:04.910026 IP 3.229.59.141.443 > 192.168.1.100.59467: Flags [P.], seq 6654:7021, ack 5288, win 338, length 367
10:17:05.367866 IP 3.229.59.141.443 > 192.168.1.100.59467: Flags [.], ack 5326, win 338, length 0
10:17:05.631780 IP 3.229.59.141.443 > 192.168.1.100.59467: Flags [.], ack 5326, win 338, options [nop,nop,sack 1 {5288:5326}], length 0
10:17:05.753763 IP 192.168.1.105.38548 > 34.160.144.191.443: Flags [P.], seq 1151:1197, ack 20721, win 501, options [nop,nop,TS val 2041968827 ecr 2261649071], length 46
10:17:05.804963 IP 34.160.144.191.443 > 192.168.1.105.38548: Flags [P.], seq 20721:20767, ack 1197, win 269, options [nop,nop,TS val 2261708129 ecr 2041968827], length 46
10:17:05.807683 IP 34.160.144.191.443 > 192.168.1.105.38548: Flags [.], ack 1197, win 269, options [nop,nop,TS val 2261708129 ecr 2041968827], length 0
10:17:05.845267 IP 192.168.1.105.38548 > 34.160.144.191.443: Flags [.], ack 20767, win 501, options [nop,nop,TS val 2041968919 ecr 2261708129], length 0
10:17:09.118273 ARP, Request who-has 192.168.1.100 tell 192.168.1.1, length 46
10:17:10.118301 ARP, Request who-has 192.168.1.100 tell 192.168.1.1, length 46
10:17:11.118436 ARP, Request who-has 192.168.1.100 tell 192.168.1.1, length 46
10:17:12.665265 IP6 fe80::b7b7:2009:6a16:626a.5353 > ff02::fb.5353: 0 [10q] PTR (QM)? _ipps._tcp.local. PTR (QM)? _pgpkey-hkp._tcp.local. PTR (QM)? _ftp._tcp.local. PTR (QM)? _webdav._tcp.local. PTR (QM)? _webdavs._tcp.local. PTR (QM)? _sftp-ssh._tcp.local. PTR (QM)? _smb._tcp.local. PTR (QM)? _afpovertcp._tcp.local. PTR (QM)? _nfs._tcp.local. PTR (QM)? _ipp._tcp.local. (159)
10:17:12.755024 IP 192.168.1.105.47840 > 34.107.243.93.443: Flags [P.], seq 978:1017, ack 3722, win 501, options [nop,nop,TS val 1477655917 ecr 2287055792], length 39
10:17:12.838700 IP 34.107.243.93.443 > 192.168.1.105.47840: Flags [P.], seq 3722:3761, ack 1017, win 262, options [nop,nop,TS val 2287114171 ecr 1477655917], length 39
10:17:12.838724 IP 192.168.1.105.47840 > 34.107.243.93.443: Flags [.], ack 3761, win 501, options [nop,nop,TS val 1477656001 ecr 2287114171], length 0
10:17:14.441296 IP 192.168.1.105.47984 > 34.107.221.82.80: Flags [.], ack 433, win 501, options [nop,nop,TS val 2133955602 ecr 996907889], length 0
