10:15:14.298544 IP6 fe80::4835:36f2:8033:ad74.61327 > ff02::c.3702: UDP, length 1185
10:15:14.298574 IP 192.168.1.100.61326 > 239.255.255.250.3702: UDP, length 1080
10:15:14.330552 IP 192.168.1.105.35850 > 34.107.243.93.443: Flags [P.], seq 674:738, ack 3066, win 501, options [nop,nop,TS val 1477537493 ecr 2520449519], length 64
10:15:14.437020 IP 192.168.1.100.61326 > 239.255.255.250.3702: UDP, length 1080
10:15:14.498802 IP6 fe80::4835:36f2:8033:ad74.61327 > ff02::c.3702: UDP, length 1185
10:15:14.518174 IP 192.168.1.105.35866 > 34.107.243.93.443: Flags [P.], seq 738:908, ack 3066, win 501, options [nop,nop,TS val 1477537681 ecr 257567825], length 170
10:15:14.712998 IP 192.168.1.100.61326 > 239.255.255.250.3702: UDP, length 1080
10:15:14.764852 IP 34.107.243.93.443 > 192.168.1.105.35850: Flags [F.], seq 3066, ack 674, win 262, options [nop,nop,TS val 2520458543 ecr 1477528903], length 0
10:15:14.788719 IP 34.107.243.93.443 > 192.168.1.105.35866: Flags [F.], seq 3066, ack 674, win 262, options [nop,nop,TS val 257576855 ecr 1477528918], length 0
10:15:14.805620 IP 192.168.1.105.35850 > 34.107.243.93.443: Flags [.], ack 3067, win 501, options [nop,nop,TS val 1477537968 ecr 2520458543], length 0
10:15:14.829497 IP 192.168.1.105.35866 > 34.107.243.93.443: Flags [.], ack 3067, win 501, options [nop,nop,TS val 1477537992 ecr 257576855], length 0
10:15:14.897516 IP6 fe80::4835:36f2:8033:ad74.61327 > ff02::c.3702: UDP, length 1185
10:15:14.921923 IP 192.168.1.105.35850 > 34.107.243.93.443: Flags [P.], seq 738:925, ack 3067, win 501, options [nop,nop,TS val 1477538084 ecr 2520458543], length 187
10:15:14.922109 IP 192.168.1.105.35866 > 34.107.243.93.443: Flags [P.], seq 908:947, ack 3067, win 501, options [nop,nop,TS val 1477538084 ecr 257576855], length 39
10:15:14.922376 IP 192.168.1.105.35850 > 34.107.243.93.443: Flags [P.], seq 925:949, ack 3067, win 501, options [nop,nop,TS val 1477538085 ecr 2520458543], length 24
10:15:14.922441 IP 192.168.1.105.35850 > 34.107.243.93.443: Flags [F.], seq 949, ack 3067, win 501, options [nop,nop,TS val 1477538085 ecr 2520458543], length 0
10:15:14.923870 IP 192.168.1.105.35866 > 34.107.243.93.443: Flags [P.], seq 947:971, ack 3067, win 501, options [nop,nop,TS val 1477538086 ecr 257576855], length 24
10:15:14.923933 IP 192.168.1.105.35866 > 34.107.243.93.443: Flags [F.], seq 971, ack 3067, win 501, options [nop,nop,TS val 1477538086 ecr 257576855], length 0
10:15:14.924424 IP 192.168.1.105.47840 > 34.107.243.93.443: Flags [S], seq 1347369919, win 64240, options [mss 1460,sackOK,TS val 1477538087 ecr 0,nop,wscale 7], length 0
10:15:14.924601 IP 192.168.1.105.47842 > 34.107.243.93.443: Flags [S], seq 2457469946, win 64240, options [mss 1460,sackOK,TS val 1477538087 ecr 0,nop,wscale 7], length 0
10:15:15.150645 IP 34.107.243.93.443 > 192.168.1.105.35866: Flags [R], seq 3151542341, win 0, length 0
10:15:15.174200 IP 192.168.1.100.61326 > 239.255.255.250.3702: UDP, length 1080
10:15:15.175669 IP 192.168.1.105.47854 > 34.107.243.93.443: Flags [S], seq 528896442, win 64240, options [mss 1460,sackOK,TS val 1477538338 ecr 0,nop,wscale 7], length 0
10:15:15.176065 IP 192.168.1.105.47868 > 34.107.243.93.443: Flags [S], seq 3256298042, win 64240, options [mss 1460,sackOK,TS val 1477538338 ecr 0,nop,wscale 7], length 0
10:15:15.202406 IP 34.107.243.93.443 > 192.168.1.105.35850: Flags [R], seq 506332727, win 0, length 0
10:15:15.211343 IP 34.107.243.93.443 > 192.168.1.105.35866: Flags [R], seq 3151542341, win 0, length 0
10:15:15.227674 IP 34.107.243.93.443 > 192.168.1.105.35850: Flags [R], seq 506332727, win 0, length 0
10:15:15.240415 IP 34.107.243.93.443 > 192.168.1.105.35850: Flags [R], seq 506332727, win 0, length 0
10:15:15.240578 IP 34.107.243.93.443 > 192.168.1.105.35866: Flags [R], seq 3151542341, win 0, length 0
10:15:15.240591 IP 34.107.243.93.443 > 192.168.1.105.35866: Flags [R], seq 3151542341, win 0, length 0
10:15:15.244715 IP 34.107.243.93.443 > 192.168.1.105.47840: Flags [S.], seq 3198666945, ack 1347369920, win 65535, options [mss 1412,sackOK,TS val 2286996571 ecr 1477538087,nop,wscale 8], length 0
10:15:15.244772 IP 192.168.1.105.47840 > 34.107.243.93.443: Flags [.], ack 1, win 502, options [nop,nop,TS val 1477538407 ecr 2286996571], length 0
10:15:15.246541 IP 192.168.1.105.47840 > 34.107.243.93.443: Flags [P.], seq 1:674, ack 1, win 502, options [nop,nop,TS val 1477538409 ecr 2286996571], length 673
10:15:15.252318 IP 34.107.243.93.443 > 192.168.1.105.47842: Flags [S.], seq 2406341525, ack 2457469947, win 65535, options [mss 1412,sackOK,TS val 1599309433 ecr 1477538087,nop,wscale 8], length 0
10:15:15.252380 IP 192.168.1.105.47842 > 34.107.243.93.443: Flags [.], ack 1, win 502, options [nop,nop,TS val 1477538415 ecr 1599309433], length 0
10:15:15.254168 IP 192.168.1.105.47842 > 34.107.243.93.443: Flags [P.], seq 1:674, ack 1, win 502, options [nop,nop,TS val 1477538417 ecr 1599309433], length 673
10:15:15.332035 IP 34.107.243.93.443 > 192.168.1.105.47854: Flags [S.], seq 4268275669, ack 528896443, win 65535, options [mss 1412,sackOK,TS val 177971023 ecr 1477538338,nop,wscale 8], length 0
10:15:15.332084 IP 192.168.1.105.47854 > 34.107.243.93.443: Flags [.], ack 1, win 502, options [nop,nop,TS val 1477538494 ecr 177971023], length 0
10:15:15.332176 IP 34.107.243.93.443 > 192.168.1.105.47868: Flags [S.], seq 1897298037, ack 3256298043, win 65535, options [mss 1412,sackOK,TS val 177971023 ecr 1477538338,nop,wscale 8], length 0
10:15:15.332186 IP 192.168.1.105.47868 > 34.107.243.93.443: Flags [.], ack 1, win 502, options [nop,nop,TS val 1477538495 ecr 177971023], length 0
10:15:15.332992 IP 192.168.1.105.47868 > 34.107.243.93.443: Flags [P.], seq 1:674, ack 1, win 502, options [nop,nop,TS val 1477538495 ecr 177971023], length 673
10:15:15.333740 IP 192.168.1.105.47854 > 34.107.243.93.443: Flags [P.], seq 1:674, ack 1, win 502, options [nop,nop,TS val 1477538496 ecr 177971023], length 673
10:15:15.349769 IP 34.107.243.93.443 > 192.168.1.105.47840: Flags [P.], seq 1:2801, ack 674, win 262, options [nop,nop,TS val 2286996677 ecr 1477538409], length 2800
10:15:15.349806 IP 192.168.1.105.47840 > 34.107.243.93.443: Flags [.], ack 2801, win 501, options [nop,nop,TS val 1477538512 ecr 2286996677], length 0
10:15:15.349866 IP 34.107.243.93.443 > 192.168.1.105.47840: Flags [.], ack 674, win 262, options [nop,nop,TS val 2286996675 ecr 1477538409], length 0
10:15:15.349872 IP 192.168.1.105.47840 > 34.107.243.93.443: Flags [.], ack 2801, win 501, options [nop,nop,TS val 1477538512 ecr 2286996677], length 0
10:15:15.349905 IP 34.107.243.93.443 > 192.168.1.105.47840: Flags [P.], seq 2801:3066, ack 674, win 262, options [nop,nop,TS val 2286996677 ecr 1477538409], length 265
10:15:15.349942 IP 192.168.1.105.47840 > 34.107.243.93.443: Flags [.], ack 3066, win 501, options [nop,nop,TS val 1477538512 ecr 2286996677], length 0
10:15:15.355791 IP 192.168.1.105.47840 > 34.107.243.93.443: Flags [P.], seq 674:738, ack 3066, win 501, options [nop,nop,TS val 1477538518 ecr 2286996677], length 64
10:15:15.357802 IP 192.168.1.105.47840 > 34.107.243.93.443: Flags [P.], seq 738:908, ack 3066, win 501, options [nop,nop,TS val 1477538520 ecr 2286996677], length 170
10:15:15.358509 IP6 fe80::4835:36f2:8033:ad74.61327 > ff02::c.3702: UDP, length 1185
10:15:15.359848 IP 34.107.243.93.443 > 192.168.1.105.47842: Flags [.], ack 674, win 262, options [nop,nop,TS val 1599309530 ecr 1477538417], length 0
10:15:15.386729 IP 34.107.243.93.443 > 192.168.1.105.47842: Flags [P.], seq 1:2801, ack 674, win 262, options [nop,nop,TS val 1599309532 ecr 1477538417], length 2800
10:15:15.386780 IP 192.168.1.105.47842 > 34.107.243.93.443: Flags [.], ack 2801, win 501, options [nop,nop,TS val 1477538549 ecr 1599309532], length 0
10:15:15.386845 IP 34.107.243.93.443 > 192.168.1.105.47842: Flags [P.], seq 2801:3066, ack 674, win 262, options [nop,nop,TS val 1599309532 ecr 1477538417], length 265
10:15:15.386852 IP 192.168.1.105.47842 > 34.107.243.93.443: Flags [.], ack 3066, win 501, options [nop,nop,TS val 1477538549 ecr 1599309532], length 0
10:15:15.391539 IP 192.168.1.105.47842 > 34.107.243.93.443: Flags [P.], seq 674:738, ack 3066, win 501, options [nop,nop,TS val 1477538554 ecr 1599309532], length 64
10:15:15.391937 IP 192.168.1.105.47842 > 34.107.243.93.443: Flags [P.], seq 738:925, ack 3066, win 501, options [nop,nop,TS val 1477538554 ecr 1599309532], length 187
10:15:15.448165 IP 34.107.243.93.443 > 192.168.1.105.47868: Flags [P.], seq 1:2801, ack 674, win 262, options [nop,nop,TS val 177971106 ecr 1477538495], length 2800
10:15:15.448200 IP 192.168.1.105.47868 > 34.107.243.93.443: Flags [.], ack 2801, win 501, options [nop,nop,TS val 1477538611 ecr 177971106], length 0
10:15:15.448306 IP 34.107.243.93.443 > 192.168.1.105.47868: Flags [P.], seq 2801:3066, ack 674, win 262, options [nop,nop,TS val 177971106 ecr 1477538495], length 265
10:15:15.448318 IP 192.168.1.105.47868 > 34.107.243.93.443: Flags [.], ack 3066, win 501, options [nop,nop,TS val 1477538611 ecr 177971106], length 0
10:15:15.448398 IP 34.107.243.93.443 > 192.168.1.105.47868: Flags [.], ack 674, win 262, options [nop,nop,TS val 177971103 ecr 1477538495], length 0
10:15:15.448405 IP 192.168.1.105.47868 > 34.107.243.93.443: Flags [.], ack 3066, win 501, options [nop,nop,TS val 1477538611 ecr 177971106], length 0
10:15:15.448449 IP 34.107.243.93.443 > 192.168.1.105.47854: Flags [.], ack 674, win 262, options [nop,nop,TS val 177971109 ecr 1477538496], length 0
10:15:15.448458 IP 34.107.243.93.443 > 192.168.1.105.47854: Flags [P.], seq 1:2801, ack 674, win 262, options [nop,nop,TS val 177971111 ecr 1477538496], length 2800
10:15:15.448464 IP 192.168.1.105.47854 > 34.107.243.93.443: Flags [.], ack 2801, win 501, options [nop,nop,TS val 1477538611 ecr 177971111], length 0
10:15:15.448523 IP 34.107.243.93.443 > 192.168.1.105.47854: Flags [P.], seq 2801:3066, ack 674, win 262, options [nop,nop,TS val 177971111 ecr 1477538496], length 265
10:15:15.448532 IP 192.168.1.105.47854 > 34.107.243.93.443: Flags [.], ack 3066, win 501, options [nop,nop,TS val 1477538611 ecr 177971111], length 0
10:15:15.448631 IP 34.107.243.93.443 > 192.168.1.105.47840: Flags [P.], seq 3066:3652, ack 738, win 262, options [nop,nop,TS val 2286996753 ecr 1477538518], length 586
10:15:15.448640 IP 34.107.243.93.443 > 192.168.1.105.47840: Flags [P.], seq 3652:3683, ack 908, win 262, options [nop,nop,TS val 2286996765 ecr 1477538520], length 31
10:15:15.649919 IP 192.168.1.105.47840 > 34.107.243.93.443: Flags [.], ack 3683, win 501, options [nop,nop,TS val 1477538812 ecr 2286996753], length 0
10:15:15.650386 IP 34.107.243.93.443 > 192.168.1.105.47842: Flags [P.], seq 3066:3652, ack 738, win 262, options [nop,nop,TS val 1599309662 ecr 1477538554], length 586
10:15:15.650416 IP 34.107.243.93.443 > 192.168.1.105.47842: Flags [P.], seq 3652:3683, ack 925, win 262, options [nop,nop,TS val 1599309668 ecr 1477538554], length 31
10:15:15.650425 IP 34.107.243.93.443 > 192.168.1.105.47840: Flags [P.], seq 3652:3683, ack 908, win 262, options [nop,nop,TS val 2286996955 ecr 1477538520], length 31
10:15:15.650439 IP 192.168.1.105.47840 > 34.107.243.93.443: Flags [.], ack 3683, win 501, options [nop,nop,TS val 1477538813 ecr 2286996955,nop,nop,sack 1 {3652:3683}], length 0
10:15:15.743893 IP 192.168.1.105.47842 > 34.107.243.93.443: Flags [.], ack 3683, win 501, options [nop,nop,TS val 1477538906 ecr 1599309662], length 0
10:15:15.744496 IP 34.107.243.93.443 > 192.168.1.105.47842: Flags [P.], seq 3652:3683, ack 925, win 262, options [nop,nop,TS val 1599309872 ecr 1477538554], length 31
10:15:15.744536 IP 192.168.1.105.47842 > 34.107.243.93.443: Flags [.], ack 3683, win 501, options [nop,nop,TS val 1477538907 ecr 1599309872,nop,nop,sack 1 {3652:3683}], length 0
10:15:15.865457 IP 192.168.1.100.51860 > 239.255.255.250.1900: UDP, length 137
10:15:15.986497 IP 192.168.1.105.47840 > 34.107.243.93.443: Flags [P.], seq 908:939, ack 3683, win 501, options [nop,nop,TS val 1477539149 ecr 2286996955], length 31
10:15:15.987515 IP 192.168.1.105.47842 > 34.107.243.93.443: Flags [P.], seq 925:949, ack 3683, win 501, options [nop,nop,TS val 1477539150 ecr 1599309872], length 24
10:15:15.988469 IP 192.168.1.105.47842 > 34.107.243.93.443: Flags [F.], seq 949, ack 3683, win 501, options [nop,nop,TS val 1477539151 ecr 1599309872], length 0
10:15:15.992462 IP 192.168.1.105.39204 > 34.107.243.93.443: Flags [S], seq 4037368777, win 64240, options [mss 1460,sackOK,TS val 1477539155 ecr 0,nop,wscale 7], length 0
10:15:15.992860 IP 192.168.1.105.39210 > 34.107.243.93.443: Flags [S], seq 4209313058, win 64240, options [mss 1460,sackOK,TS val 1477539155 ecr 0,nop,wscale 7], length 0
10:15:15.994318 IP 192.168.1.105.47868 > 34.107.243.93.443: Flags [P.], seq 674:738, ack 3066, win 501, options [nop,nop,TS val 1477539157 ecr 177971106], length 64
10:15:15.994639 IP 192.168.1.105.47868 > 34.107.243.93.443: Flags [P.], seq 738:925, ack 3066, win 501, options [nop,nop,TS val 1477539157 ecr 177971106], length 187
10:15:15.997095 IP 192.168.1.105.47854 > 34.107.243.93.443: Flags [P.], seq 674:738, ack 3066, win 501, options [nop,nop,TS val 1477539159 ecr 177971111], length 64
10:15:15.997490 IP 192.168.1.105.47854 > 34.107.243.93.443: Flags [P.], seq 738:925, ack 3066, win 501, options [nop,nop,TS val 1477539160 ecr 177971111], length 187
10:15:16.048004 IP 34.107.243.93.443 > 192.168.1.105.47842: Flags [F.], seq 3683, ack 949, win 262, options [nop,nop,TS val 1599310228 ecr 1477539150], length 0
10:15:16.048027 IP 192.168.1.105.47842 > 34.107.243.93.443: Flags [.], ack 3684, win 501, options [nop,nop,TS val 1477539210 ecr 1599310228], length 0
10:15:16.048099 IP 34.107.243.93.443 > 192.168.1.105.47840: Flags [.], ack 939, win 262, options [nop,nop,TS val 2286997378 ecr 1477539149], length 0
10:15:16.055895 IP 34.107.243.93.443 > 192.168.1.105.39210: Flags [S.], seq 3008048483, ack 4209313059, win 65535, options [mss 1412,sackOK,TS val 3323653116 ecr 1477539155,nop,wscale 8], length 0
10:15:16.055954 IP 192.168.1.105.39210 > 34.107.243.93.443: Flags [.], ack 1, win 502, options [nop,nop,TS val 1477539218 ecr 3323653116], length 0
10:15:16.056035 IP 34.107.243.93.443 > 192.168.1.105.39204: Flags [S.], seq 4187837793, ack 4037368778, win 65535, options [mss 1412,sackOK,TS val 4260977083 ecr 1477539155,nop,wscale 8], length 0
10:15:16.056065 IP 192.168.1.105.39204 > 34.107.243.93.443: Flags [.], ack 1, win 502, options [nop,nop,TS val 1477539218 ecr 4260977083], length 0
10:15:16.057240 IP 192.168.1.105.39210 > 34.107.243.93.443: Flags [P.], seq 1:1231, ack 1, win 502, options [nop,nop,TS val 1477539220 ecr 3323653116], length 1230
10:15:16.059205 IP 192.168.1.105.39204 > 34.107.243.93.443: Flags [P.], seq 1:1231, ack 1, win 502, options [nop,nop,TS val 1477539222 ecr 4260977083], length 1230
10:15:16.059502 IP 34.107.243.93.443 > 192.168.1.105.47842: Flags [.], ack 950, win 262, options [nop,nop,TS val 1599310232 ecr 1477539151], length 0
10:15:16.062355 IP 34.107.243.93.443 > 192.168.1.105.47868: Flags [P.], seq 3066:3652, ack 738, win 262, options [nop,nop,TS val 177971755 ecr 1477539157], length 586
10:15:16.062403 IP 192.168.1.105.47868 > 34.107.243.93.443: Flags [.], ack 3652, win 501, options [nop,nop,TS val 1477539225 ecr 177971755], length 0
10:15:16.063201 IP 192.168.1.105.47868 > 34.107.243.93.443: Flags [P.], seq 925:949, ack 3652, win 501, options [nop,nop,TS val 1477539226 ecr 177971755], length 24
10:15:16.063283 IP 192.168.1.105.47868 > 34.107.243.93.443: Flags [F.], seq 949, ack 3652, win 501, options [nop,nop,TS val 1477539226 ecr 177971755], length 0
10:15:16.074102 IP 34.107.243.93.443 > 192.168.1.105.47868: Flags [P.], seq 3652:3683, ack 925, win 262, options [nop,nop,TS val 177971757 ecr 1477539157], length 31
10:15:16.074180 IP 192.168.1.105.47868 > 34.107.243.93.443: Flags [R], seq 3256298967, win 0, length 0
10:15:16.074267 IP 34.107.243.93.443 > 192.168.1.105.47854: Flags [P.], seq 3066:3652, ack 738, win 262, options [nop,nop,TS val 177971757 ecr 1477539159], length 586
10:15:16.074291 IP 192.168.1.105.47854 > 34.107.243.93.443: Flags [.], ack 3652, win 501, options [nop,nop,TS val 1477539237 ecr 177971757], length 0
10:15:16.074333 IP 34.107.243.93.443 > 192.168.1.105.47854: Flags [P.], seq 3652:3683, ack 925, win 262, options [nop,nop,TS val 177971765 ecr 1477539160], length 31
10:15:16.074341 IP 192.168.1.105.47854 > 34.107.243.93.443: Flags [.], ack 3683, win 501, options [nop,nop,TS val 1477539237 ecr 177971765], length 0
10:15:16.075140 IP 192.168.1.105.47854 > 34.107.243.93.443: Flags [P.], seq 925:949, ack 3683, win 501, options [nop,nop,TS val 1477539238 ecr 177971765], length 24
10:15:16.075246 IP 192.168.1.105.47854 > 34.107.243.93.443: Flags [F.], seq 949, ack 3683, win 501, options [nop,nop,TS val 1477539238 ecr 177971765], length 0
10:15:16.080409 IP 192.168.1.105.49679 > 192.168.1.1.53: 23600+ A? mail.psca.gop.pk. (34)
10:15:16.081481 IP 192.168.1.105.42711 > 192.168.1.1.53: 35025+ AAAA? mail.psca.gop.pk. (34)
10:15:16.150028 IP 34.107.243.93.443 > 192.168.1.105.39210: Flags [.], ack 1231, win 267, options [nop,nop,TS val 3323653195 ecr 1477539220], length 0
10:15:16.150046 IP 34.107.243.93.443 > 192.168.1.105.39204: Flags [.], ack 1231, win 267, options [nop,nop,TS val 4260977167 ecr 1477539222], length 0
10:15:16.155883 IP 192.168.1.1.53 > 192.168.1.105.42711: 35025 0/1/0 (96)
10:15:16.155902 IP 192.168.1.1.53 > 192.168.1.105.49679: 23600 1/0/0 A 110.93.206.253 (50)
10:15:16.157063 IP 192.168.1.105.34746 > 110.93.206.253.443: Flags [S], seq 49582440, win 64240, options [mss 1460,sackOK,TS val 3729970331 ecr 0,nop,wscale 7], length 0
10:15:16.157366 IP 192.168.1.105.34758 > 110.93.206.253.443: Flags [S], seq 2044880744, win 64240, options [mss 1460,sackOK,TS val 3729970332 ecr 0,nop,wscale 7], length 0
10:15:16.164286 IP 34.107.243.93.443 > 192.168.1.105.47868: Flags [.], ack 925, win 262, options [nop,nop,TS val 177971850 ecr 1477539225,nop,nop,sack 1 {949:950}], length 0
10:15:16.164356 IP 192.168.1.105.47868 > 34.107.243.93.443: Flags [R], seq 3256298967, win 0, length 0
10:15:16.164407 IP 34.107.243.93.443 > 192.168.1.105.47868: Flags [.], ack 950, win 262, options [nop,nop,TS val 177971850 ecr 1477539226], length 0
10:15:16.164414 IP 192.168.1.105.47868 > 34.107.243.93.443: Flags [R], seq 3256298992, win 0, length 0
10:15:16.164447 IP 34.107.243.93.443 > 192.168.1.105.47868: Flags [F.], seq 3683, ack 950, win 262, options [nop,nop,TS val 177971850 ecr 1477539226], length 0
10:15:16.164455 IP 192.168.1.105.47868 > 34.107.243.93.443: Flags [R], seq 3256298992, win 0, length 0
10:15:16.178636 IP 34.107.243.93.443 > 192.168.1.105.47854: Flags [.], ack 925, win 262, options [nop,nop,TS val 177971857 ecr 1477539237,nop,nop,sack 1 {949:950}], length 0
10:15:16.178744 IP 34.107.243.93.443 > 192.168.1.105.47854: Flags [F.], seq 3683, ack 950, win 262, options [nop,nop,TS val 177971863 ecr 1477539238], length 0
10:15:16.178789 IP 192.168.1.105.47854 > 34.107.243.93.443: Flags [.], ack 3684, win 501, options [nop,nop,TS val 1477539341 ecr 177971863], length 0
10:15:16.179011 IP 34.107.243.93.443 > 192.168.1.105.47854: Flags [.], ack 950, win 262, options [nop,nop,TS val 177971863 ecr 1477539238], length 0
10:15:16.179178 IP 192.168.1.105.47854 > 34.107.243.93.443: Flags [.], ack 3684, win 501, options [nop,nop,TS val 1477539342 ecr 177971863], length 0
10:15:16.213044 IP 110.93.206.253.443 > 192.168.1.105.34746: Flags [S.], seq 4130869948, ack 49582441, win 8192, options [mss 1200,nop,wscale 8,sackOK,TS val 107360269 ecr 3729970331], length 0
10:15:16.213223 IP 192.168.1.105.34746 > 110.93.206.253.443: Flags [.], ack 1, win 502, options [nop,nop,TS val 3729970388 ecr 107360269], length 0
10:15:16.214859 IP 110.93.206.253.443 > 192.168.1.105.34758: Flags [S.], seq 2805937062, ack 2044880745, win 8192, options [mss 1200,nop,wscale 8,sackOK,TS val 107360269 ecr 3729970332], length 0
10:15:16.214886 IP 192.168.1.105.34758 > 110.93.206.253.443: Flags [.], ack 1, win 502, options [nop,nop,TS val 3729970389 ecr 107360269], length 0
10:15:16.215060 IP 192.168.1.105.34746 > 110.93.206.253.443: Flags [P.], seq 1:665, ack 1, win 502, options [nop,nop,TS val 3729970389 ecr 107360269], length 664
10:15:16.216722 IP 192.168.1.105.34758 > 110.93.206.253.443: Flags [P.], seq 1:665, ack 1, win 502, options [nop,nop,TS val 3729970391 ecr 107360269], length 664
10:15:16.242069 IP 34.107.243.93.443 > 192.168.1.105.39210: Flags [P.], seq 1:219, ack 1231, win 267, options [nop,nop,TS val 3323653301 ecr 1477539220], length 218
10:15:16.242146 IP 192.168.1.105.39210 > 34.107.243.93.443: Flags [.], ack 219, win 501, options [nop,nop,TS val 1477539404 ecr 3323653301], length 0
10:15:16.242941 IP 192.168.1.105.39210 > 34.107.243.93.443: Flags [P.], seq 1231:1295, ack 219, win 501, options [nop,nop,TS val 1477539405 ecr 3323653301], length 64
10:15:16.243372 IP 192.168.1.105.39210 > 34.107.243.93.443: Flags [P.], seq 1295:1925, ack 219, win 501, options [nop,nop,TS val 1477539406 ecr 3323653301], length 630
10:15:16.257943 IP 34.107.243.93.443 > 192.168.1.105.39204: Flags [P.], seq 1:219, ack 1231, win 267, options [nop,nop,TS val 4260977274 ecr 1477539222], length 218
10:15:16.258005 IP 192.168.1.105.39204 > 34.107.243.93.443: Flags [.], ack 219, win 501, options [nop,nop,TS val 1477539420 ecr 4260977274], length 0
10:15:16.259086 IP 192.168.1.105.39204 > 34.107.243.93.443: Flags [P.], seq 1231:1295, ack 219, win 501, options [nop,nop,TS val 1477539421 ecr 4260977274], length 64
10:15:16.259720 IP 192.168.1.105.39204 > 34.107.243.93.443: Flags [P.], seq 1295:1925, ack 219, win 501, options [nop,nop,TS val 1477539422 ecr 4260977274], length 630
10:15:16.260594 IP 34.107.243.93.443 > 192.168.1.105.47854: Flags [R], seq 4268279353, win 0, length 0
10:15:16.285627 IP 110.93.206.253.443 > 192.168.1.105.34746: Flags [P.], seq 1:4721, ack 665, win 259, options [nop,nop,TS val 107360275 ecr 3729970389], length 4720
10:15:16.285685 IP 192.168.1.105.34746 > 110.93.206.253.443: Flags [.], ack 4721, win 501, options [nop,nop,TS val 3729970460 ecr 107360275], length 0
10:15:16.292380 IP 110.93.206.253.443 > 192.168.1.105.34758: Flags [P.], seq 1:4721, ack 665, win 259, options [nop,nop,TS val 107360276 ecr 3729970391], length 4720
10:15:16.292405 IP 192.168.1.105.34758 > 110.93.206.253.443: Flags [.], ack 4721, win 501, options [nop,nop,TS val 3729970467 ecr 107360276], length 0
10:15:16.308513 IP 34.107.243.93.443 > 192.168.1.105.39210: Flags [.], ack 1295, win 267, options [nop,nop,TS val 3323653365 ecr 1477539405], length 0
10:15:16.318304 IP 34.107.243.93.443 > 192.168.1.105.39210: Flags [.], ack 1925, win 277, options [nop,nop,TS val 3323653373 ecr 1477539406], length 0
10:15:16.328980 IP 34.107.243.93.443 > 192.168.1.105.39204: Flags [.], ack 1295, win 267, options [nop,nop,TS val 4260977346 ecr 1477539421], length 0
10:15:16.338571 IP 34.107.243.93.443 > 192.168.1.105.39204: Flags [.], ack 1925, win 277, options [nop,nop,TS val 4260977357 ecr 1477539422], length 0
10:15:16.550498 IP 34.107.243.93.443 > 192.168.1.105.39210: Flags [P.], seq 219:1017, ack 1925, win 277, options [nop,nop,TS val 3323653610 ecr 1477539406], length 798
10:15:16.578934 IP 110.93.206.253.443 > 192.168.1.105.34746: Flags [.], seq 1:1189, ack 665, win 259, options [nop,nop,TS val 107360305 ecr 3729970389], length 1188
10:15:16.578958 IP 192.168.1.105.34746 > 110.93.206.253.443: Flags [.], ack 4721, win 501, options [nop,nop,TS val 3729970753 ecr 107360275,nop,nop,sack 1 {1:1189}], length 0
10:15:16.584261 IP 34.107.243.93.443 > 192.168.1.105.39204: Flags [P.], seq 219:1017, ack 1925, win 277, options [nop,nop,TS val 4260977600 ecr 1477539422], length 798
10:15:16.591181 IP 192.168.1.105.39210 > 34.107.243.93.443: Flags [.], ack 1017, win 495, options [nop,nop,TS val 1477539754 ecr 3323653610], length 0
10:15:16.625193 IP 192.168.1.105.39204 > 34.107.243.93.443: Flags [.], ack 1017, win 495, options [nop,nop,TS val 1477539788 ecr 4260977600], length 0
10:15:16.670566 IP6 fe80::b7b7:2009:6a16:626a > ff02::2: ICMP6, router solicitation, length 8
10:15:16.732563 IP 192.168.1.105.34746 > 110.93.206.253.443: Flags [P.], seq 665:815, ack 4721, win 501, options [nop,nop,TS val 3729970907 ecr 107360275], length 150
10:15:16.740741 IP 192.168.1.105.34758 > 110.93.206.253.443: Flags [P.], seq 665:815, ack 4721, win 501, options [nop,nop,TS val 3729970915 ecr 107360276], length 150
10:15:16.781952 IP 110.93.206.253.443 > 192.168.1.105.34758: Flags [P.], seq 4721:4796, ack 815, win 259, options [nop,nop,TS val 107360326 ecr 3729970915], length 75
10:15:16.781978 IP 192.168.1.105.34758 > 110.93.206.253.443: Flags [.], ack 4796, win 501, options [nop,nop,TS val 3729970956 ecr 107360326], length 0
10:15:16.782084 IP 110.93.206.253.443 > 192.168.1.105.34746: Flags [P.], seq 4721:4796, ack 815, win 259, options [nop,nop,TS val 107360326 ecr 3729970907], length 75
10:15:16.782096 IP 192.168.1.105.34746 > 110.93.206.253.443: Flags [.], ack 4796, win 501, options [nop,nop,TS val 3729970956 ecr 107360326], length 0
10:15:17.491796 IP 192.168.1.105.39210 > 34.107.243.93.443: Flags [P.], seq 1925:1949, ack 1017, win 495, options [nop,nop,TS val 1477540654 ecr 3323653610], length 24
10:15:17.491951 IP 192.168.1.105.39210 > 34.107.243.93.443: Flags [F.], seq 1949, ack 1017, win 495, options [nop,nop,TS val 1477540654 ecr 3323653610], length 0
10:15:17.494514 IP 192.168.1.105.39204 > 34.107.243.93.443: Flags [P.], seq 1925:1949, ack 1017, win 495, options [nop,nop,TS val 1477540657 ecr 4260977600], length 24
10:15:17.496179 IP 192.168.1.105.39204 > 34.107.243.93.443: Flags [F.], seq 1949, ack 1017, win 495, options [nop,nop,TS val 1477540659 ecr 4260977600], length 0
10:15:17.580942 IP 34.107.243.93.443 > 192.168.1.105.39204: Flags [F.], seq 1017, ack 1950, win 277, options [nop,nop,TS val 4260978606 ecr 1477540657], length 0
10:15:17.580968 IP 192.168.1.105.39204 > 34.107.243.93.443: Flags [.], ack 1018, win 495, options [nop,nop,TS val 1477540743 ecr 4260978606], length 0
10:15:17.581041 IP 34.107.243.93.443 > 192.168.1.105.39210: Flags [F.], seq 1017, ack 1950, win 277, options [nop,nop,TS val 3323654640 ecr 1477540654], length 0
10:15:17.581048 IP 192.168.1.105.39210 > 34.107.243.93.443: Flags [.], ack 1018, win 495, options [nop,nop,TS val 1477540743 ecr 3323654640], length 0
10:15:17.588362 IP 34.107.243.93.443 > 192.168.1.105.39204: Flags [.], ack 1925, win 277, options [nop,nop,TS val 4260978606 ecr 1477539788,nop,nop,sack 1 {1949:1950}], length 0
10:15:17.588416 IP 192.168.1.105.39204 > 34.107.243.93.443: Flags [.], ack 1018, win 495, options [nop,nop,TS val 1477540751 ecr 4260978606], length 0
10:15:17.588597 IP 34.107.243.93.443 > 192.168.1.105.39204: Flags [.], ack 1950, win 277, options [nop,nop,TS val 4260978606 ecr 1477540657], length 0
10:15:17.588614 IP 34.107.243.93.443 > 192.168.1.105.39210: Flags [.], ack 1925, win 277, options [nop,nop,TS val 3323654640 ecr 1477539754,nop,nop,sack 1 {1949:1950}], length 0
10:15:17.588634 IP 192.168.1.105.39210 > 34.107.243.93.443: Flags [.], ack 1018, win 495, options [nop,nop,TS val 1477540751 ecr 3323654640], length 0
10:15:17.588770 IP 34.107.243.93.443 > 192.168.1.105.39210: Flags [.], ack 1950, win 277, options [nop,nop,TS val 3323654640 ecr 1477540654], length 0
10:15:17.643617 IP 34.107.243.93.443 > 192.168.1.105.39204: Flags [R], seq 4187838811, win 0, length 0
10:15:17.647470 IP 34.107.243.93.443 > 192.168.1.105.39210: Flags [R], seq 3008049501, win 0, length 0
10:15:18.161185 IP 192.168.1.105.34746 > 110.93.206.253.443: Flags [P.], seq 815:2788, ack 4796, win 501, options [nop,nop,TS val 3729972336 ecr 107360326], length 1973
10:15:18.208113 IP 110.93.206.253.443 > 192.168.1.105.34746: Flags [.], ack 2788, win 259, options [nop,nop,TS val 107360468 ecr 3729972336], length 0
10:15:18.215008 IP 110.93.206.253.443 > 192.168.1.105.34746: Flags [FP.], seq 4796:5617, ack 2788, win 259, options [nop,nop,TS val 107360469 ecr 3729972336], length 821
10:15:18.216244 IP 192.168.1.105.34746 > 110.93.206.253.443: Flags [P.], seq 2788:2841, ack 5618, win 501, options [nop,nop,TS val 3729972391 ecr 107360469], length 53
10:15:18.216377 IP 192.168.1.105.34746 > 110.93.206.253.443: Flags [F.], seq 2841, ack 5618, win 501, options [nop,nop,TS val 3729972391 ecr 107360469], length 0
10:15:18.248331 IP 110.93.206.253.443 > 192.168.1.105.34746: Flags [.], ack 2788, win 259, options [nop,nop,TS val 107360472 ecr 3729972336], length 0
10:15:18.258311 IP 110.93.206.253.443 > 192.168.1.105.34746: Flags [.], ack 2842, win 259, options [nop,nop,TS val 107360473 ecr 3729972391], length 0
10:15:18.877734 IP 192.168.1.100.51860 > 239.255.255.250.1900: UDP, length 137
10:15:20.192854 IP 192.168.1.105.47982 > 34.107.221.82.80: Flags [S], seq 2240877002, win 64240, options [mss 1460,sackOK,TS val 2133841353 ecr 0,nop,wscale 7], length 0
10:15:20.244305 IP 34.107.221.82.80 > 192.168.1.105.47982: Flags [S.], seq 740676538, ack 2240877003, win 65535, options [mss 1412,sackOK,TS val 2214428376 ecr 2133841353,nop,wscale 8], length 0
10:15:20.244339 IP 192.168.1.105.47982 > 34.107.221.82.80: Flags [.], ack 1, win 502, options [nop,nop,TS val 2133841405 ecr 2214428376], length 0
10:15:20.244578 IP 192.168.1.105.47982 > 34.107.221.82.80: Flags [P.], seq 1:302, ack 1, win 502, options [nop,nop,TS val 2133841405 ecr 2214428376], length 301: HTTP: GET /canonical.html HTTP/1.1
10:15:20.298041 IP 34.107.221.82.80 > 192.168.1.105.47982: Flags [.], ack 302, win 261, options [nop,nop,TS val 2214428428 ecr 2133841405], length 0
10:15:20.306403 IP 34.107.221.82.80 > 192.168.1.105.47982: Flags [P.], seq 1:299, ack 302, win 261, options [nop,nop,TS val 2214428429 ecr 2133841405], length 298: HTTP: HTTP/1.1 200 OK
10:15:20.306436 IP 192.168.1.105.47982 > 34.107.221.82.80: Flags [.], ack 299, win 501, options [nop,nop,TS val 2133841467 ecr 2214428429], length 0
10:15:20.308358 IP 192.168.1.105.48718 > 192.168.1.1.53: 46897+ A? example.org. (29)
10:15:20.308571 IP 192.168.1.105.47650 > 192.168.1.1.53: 24662+ AAAA? example.org. (29)
10:15:20.309345 IP 192.168.1.105.55051 > 192.168.1.1.53: 24719+ AAAA? ipv4only.arpa. (31)
10:15:20.309814 IP 192.168.1.105.47984 > 34.107.221.82.80: Flags [S], seq 1479071449, win 64240, options [mss 1460,sackOK,TS val 2133841470 ecr 0,nop,wscale 7], length 0
10:15:20.341510 IP 192.168.1.1.53 > 192.168.1.105.47650: 24662 1/0/0 AAAA 2606:2800:21f:cb07:6820:80da:af6b:8b2c (57)
10:15:20.344462 IP 192.168.1.1.53 > 192.168.1.105.48718: 46897 1/0/0 A 93.184.215.14 (45)
10:15:20.344473 IP 192.168.1.1.53 > 192.168.1.105.55051: 24719 0/1/0 (88)
10:15:20.364898 IP 34.107.221.82.80 > 192.168.1.105.47984: Flags [S.], seq 1663914659, ack 1479071450, win 65535, options [mss 1412,sackOK,TS val 996803976 ecr 2133841470,nop,wscale 8], length 0
10:15:20.364937 IP 192.168.1.105.47984 > 34.107.221.82.80: Flags [.], ack 1, win 502, options [nop,nop,TS val 2133841525 ecr 996803976], length 0
10:15:20.365314 IP 192.168.1.105.47984 > 34.107.221.82.80: Flags [P.], seq 1:319, ack 1, win 502, options [nop,nop,TS val 2133841526 ecr 996803976], length 318: HTTP: GET /success.txt?ipv4 HTTP/1.1
10:15:20.427965 IP 34.107.221.82.80 > 192.168.1.105.47984: Flags [.], ack 319, win 261, options [nop,nop,TS val 996804039 ecr 2133841526], length 0
10:15:20.430278 IP 34.107.221.82.80 > 192.168.1.105.47984: Flags [P.], seq 1:217, ack 319, win 261, options [nop,nop,TS val 996804040 ecr 2133841526], length 216: HTTP: HTTP/1.1 200 OK
10:15:20.430310 IP 192.168.1.105.47984 > 34.107.221.82.80: Flags [.], ack 217, win 501, options [nop,nop,TS val 2133841591 ecr 996804040], length 0
10:15:20.553568 IP6 fe80::4835:36f2:8033:ad74.61327 > ff02::c.3702: UDP, length 1185
10:15:20.553569 IP 192.168.1.100.61326 > 239.255.255.250.3702: UDP, length 1080
10:15:20.767506 IP 192.168.1.100.61326 > 239.255.255.250.3702: UDP, length 1080
10:15:20.797859 IP6 fe80::4835:36f2:8033:ad74.61327 > ff02::c.3702: UDP, length 1185
10:15:21.197415 IP 192.168.1.100.61326 > 239.255.255.250.3702: UDP, length 1080
10:15:21.258945 IP6 fe80::4835:36f2:8033:ad74.61327 > ff02::c.3702: UDP, length 1185
10:15:21.619590 IP 192.168.1.100.5353 > 224.0.0.251.5353: 0 PTR (QM)? _googlecast._tcp.local. (40)
10:15:21.620398 IP6 fe80::4835:36f2:8033:ad74.5353 > ff02::fb.5353: 0 PTR (QM)? _googlecast._tcp.local. (40)
10:15:21.623353 IP 192.168.1.100.5353 > 224.0.0.251.5353: 0 PTR (QM)? _googlecast._tcp.local. (40)
10:15:21.623955 IP6 fe80::4835:36f2:8033:ad74.5353 > ff02::fb.5353: 0 PTR (QM)? _googlecast._tcp.local. (40)
10:15:21.658796 IP 192.168.1.100.61326 > 239.255.255.250.3702: UDP, length 1080
10:15:21.720402 IP6 fe80::4835:36f2:8033:ad74.61327 > ff02::c.3702: UDP, length 1185
10:15:21.893481 IP 192.168.1.100.51860 > 239.255.255.250.1900: UDP, length 137
10:15:22.081352 IP 192.168.1.100.51714 > 239.255.255.250.1900: UDP, length 175
10:15:22.082219 IP 192.168.1.100.51717 > 239.255.255.250.1900: UDP, length 175
10:15:22.193957 IP 192.168.1.105.34758 > 110.93.206.253.443: Flags [P.], seq 815:868, ack 4796, win 501, options [nop,nop,TS val 3729976368 ecr 107360326], length 53
10:15:22.194065 IP 192.168.1.105.34758 > 110.93.206.253.443: Flags [F.], seq 868, ack 4796, win 501, options [nop,nop,TS val 3729976368 ecr 107360326], length 0
10:15:22.196022 IP 192.168.1.105.40407 > 192.168.1.1.53: 48396+ AAAA? connectivity-check.ubuntu.com. (47)
10:15:22.196686 IP 192.168.1.105.35631 > 192.168.1.1.53: 19542+ A? connectivity-check.ubuntu.com. (47)
10:15:22.298651 IP 192.168.1.105.5353 > 224.0.0.251.5353: 0 [10q] PTR (QM)? _ipps._tcp.local. PTR (QM)? _pgpkey-hkp._tcp.local. PTR (QM)? _ftp._tcp.local. PTR (QM)? _webdav._tcp.local. PTR (QM)? _webdavs._tcp.local. PTR (QM)? _sftp-ssh._tcp.local. PTR (QM)? _smb._tcp.local. PTR (QM)? _afpovertcp._tcp.local. PTR (QM)? _nfs._tcp.local. PTR (QM)? _ipp._tcp.local. (159)
10:15:22.314321 IP 192.168.1.105.34758 > 110.93.206.253.443: Flags [F.], seq 868, ack 4796, win 501, options [nop,nop,TS val 3729976489 ecr 107360326], length 0
10:15:22.577427 IP 192.168.1.105.34758 > 110.93.206.253.443: Flags [FP.], seq 815:868, ack 4796, win 501, options [nop,nop,TS val 3729976752 ecr 107360326], length 53
10:15:22.760912 IP 192.168.1.105.46584 > 192.168.1.1.53: 43379+ A? appsforoffice.microsoft.com. (45)
10:15:22.761377 IP 192.168.1.105.52441 > 192.168.1.1.53: 55999+ AAAA? appsforoffice.microsoft.com. (45)
10:15:22.761513 IP 192.168.1.105.47703 > 192.168.1.1.53: 20882+ Type65? appsforoffice.microsoft.com. (45)
10:15:22.761715 IP 192.168.1.105.34766 > 110.93.206.253.443: Flags [S], seq 2951915275, win 64240, options [mss 1460,sackOK,TS val 3729976936 ecr 0,nop,wscale 7], length 0
10:15:23.059564 IP 192.168.1.100.137 > 192.168.1.255.137: UDP, length 50
10:15:23.060876 IP 192.168.1.100.137 > 192.168.1.255.137: UDP, length 50
10:15:23.061455 IP 192.168.1.100.5353 > 224.0.0.251.5353: 0 A (QM)? AV01.local. (28)
10:15:23.063937 IP6 fe80::4835:36f2:8033:ad74.5353 > ff02::fb.5353: 0 A (QM)? AV01.local. (28)
10:15:23.064905 IP 192.168.1.100.5353 > 224.0.0.251.5353: 0 A (QM)? AV01.local. (28)
10:15:23.066518 IP6 fe80::4835:36f2:8033:ad74.5353 > ff02::fb.5353: 0 A (QM)? AV01.local. (28)
10:15:23.067637 IP 192.168.1.100.5353 > 224.0.0.251.5353: 0 AAAA (QM)? AV01.local. (28)
10:15:23.069214 IP6 fe80::4835:36f2:8033:ad74.5353 > ff02::fb.5353: 0 AAAA (QM)? AV01.local. (28)
10:15:23.069833 IP6 fe80::4835:36f2:8033:ad74.65408 > ff02::1:3.5355: UDP, length 22
10:15:23.070038 IP 192.168.1.100.65408 > 224.0.0.252.5355: UDP, length 22
10:15:23.070516 IP6 fe80::4835:36f2:8033:ad74.58449 > ff02::1:3.5355: UDP, length 22
10:15:23.070517 IP 192.168.1.100.5353 > 224.0.0.251.5353: 0 AAAA (QM)? AV01.local. (28)
10:15:23.070747 IP 192.168.1.100.58449 > 224.0.0.252.5355: UDP, length 22
10:15:23.072547 IP6 fe80::4835:36f2:8033:ad74.5353 > ff02::fb.5353: 0 AAAA (QM)? AV01.local. (28)
10:15:23.073179 IP6 fe80::4835:36f2:8033:ad74.64324 > ff02::1:3.5355: UDP, length 22
10:15:23.073364 IP 192.168.1.100.64324 > 224.0.0.252.5355: UDP, length 22
10:15:23.073775 IP6 fe80::4835:36f2:8033:ad74.54218 > ff02::1:3.5355: UDP, length 22
10:15:23.073775 IP 192.168.1.100.5353 > 224.0.0.251.5353: 0 A (QM)? AV01.local. (28)
10:15:23.073986 IP 192.168.1.100.54218 > 224.0.0.252.5355: UDP, length 22
10:15:23.075558 IP6 fe80::4835:36f2:8033:ad74.5353 > ff02::fb.5353: 0 A (QM)? AV01.local. (28)
10:15:23.076552 IP 192.168.1.100.5353 > 224.0.0.251.5353: 0 A (QM)? AV01.local. (28)
10:15:23.078104 IP6 fe80::4835:36f2:8033:ad74.5353 > ff02::fb.5353: 0 A (QM)? AV01.local. (28)
10:15:23.079215 IP 192.168.1.100.5353 > 224.0.0.251.5353: 0 AAAA (QM)? AV01.local. (28)
10:15:23.080792 IP6 fe80::4835:36f2:8033:ad74.5353 > ff02::fb.5353: 0 AAAA (QM)? AV01.local. (28)
10:15:23.081601 IP 192.168.1.100.51714 > 239.255.255.250.1900: UDP, length 175
10:15:23.082182 IP 192.168.1.100.5353 > 224.0.0.251.5353: 0 AAAA (QM)? AV01.local. (28)
10:15:23.083075 IP 192.168.1.100.51717 > 239.255.255.250.1900: UDP, length 175
10:15:23.083937 IP6 fe80::4835:36f2:8033:ad74.5353 > ff02::fb.5353: 0 AAAA (QM)? AV01.local. (28)
10:15:23.128017 IP 110.93.206.253.443 > 192.168.1.105.34758: Flags [.], ack 815, win 259, options [nop,nop,TS val 107360960 ecr 3729970956], length 0
10:15:23.128034 IP 192.168.1.1.53 > 192.168.1.105.40407: 48396 12/0/0 AAAA 2001:67c:1562::23, AAAA 2620:2d:4002:1::197, AAAA 2620:2d:4000:1::22, AAAA 2620:2d:4002:1::196, AAAA 2620:2d:4000:1::2a, AAAA 2620:2d:4002:1::198, AAAA 2620:2d:4000:1::96, AAAA 2620:2d:4000:1::97, AAAA 2620:2d:4000:1::98, AAAA 2620:2d:4000:1::23, AAAA 2001:67c:1562::24, AAAA 2620:2d:4000:1::2b (383)
10:15:23.138572 IP 192.168.1.1.53 > 192.168.1.105.35631: 19542 12/0/0 A 185.125.190.18, A 91.189.91.97, A 91.189.91.96, A 91.189.91.49, A 91.189.91.48, A 185.125.190.48, A 91.189.91.98, A 185.125.190.17, A 185.125.190.97, A 185.125.190.96, A 185.125.190.49, A 185.125.190.98 (239)
10:15:23.139343 IP 192.168.1.105.40764 > 185.125.190.18.80: Flags [S], seq 2235697692, win 64240, options [mss 1460,sackOK,TS val 2949864407 ecr 0,nop,wscale 7], length 0
10:15:23.142433 IP 110.93.206.253.443 > 192.168.1.105.34758: Flags [R.], seq 4796, ack 869, win 0, length 0
10:15:23.161906 IP 192.168.1.1.53 > 192.168.1.105.46584: 43379 5/0/0 CNAME m365cdn-sdp-public.azurefd.net., CNAME azurefd-t-prod.trafficmanager.net., CNAME shed.dual-low.s-part-0032.t-0009.t-msedge.net., CNAME s-part-0032.t-0009.t-msedge.net., A 13.107.246.60 (219)
10:15:23.164975 IP 110.93.206.253.443 > 192.168.1.105.34766: Flags [S.], seq 3410844961, ack 2951915276, win 8192, options [mss 1200,nop,wscale 8,sackOK,TS val 107360964 ecr 3729976936], length 0
10:15:23.165015 IP 192.168.1.105.34766 > 110.93.206.253.443: Flags [.], ack 1, win 502, options [nop,nop,TS val 3729977339 ecr 107360964], length 0
10:15:23.165817 IP 192.168.1.105.34766 > 110.93.206.253.443: Flags [P.], seq 1:665, ack 1, win 502, options [nop,nop,TS val 3729977340 ecr 107360964], length 664
10:15:23.175257 IP 192.168.1.1.53 > 192.168.1.105.52441: 55999 5/0/0 CNAME m365cdn-sdp-public.azurefd.net., CNAME azurefd-t-prod.trafficmanager.net., CNAME shed.dual-low.s-part-0014.t-0009.t-msedge.net., CNAME s-part-0014.t-0009.t-msedge.net., AAAA 2620:1ec:bdf::42 (231)
10:15:23.195090 IP 192.168.1.1.53 > 192.168.1.105.47703: 20882 3/1/0 CNAME m365cdn-sdp-public.azurefd.net., CNAME azurefd-t-prod.trafficmanager.net., CNAME shed.dual-low.s-part-0014.t-0009.t-msedge.net. (236)
10:15:23.195447 IP 192.168.1.105.52368 > 192.168.1.1.53: 58400+ Type65? s-part-0014.t-0009.t-msedge.net. (49)
10:15:23.417070 IP 192.168.1.1.53 > 192.168.1.105.52368: 58400 0/1/0 (109)
10:15:23.432575 IP 110.93.206.253.443 > 192.168.1.105.34766: Flags [P.], seq 1:4721, ack 665, win 259, options [nop,nop,TS val 107360990 ecr 3729977340], length 4720
10:15:23.432619 IP 192.168.1.105.34766 > 110.93.206.253.443: Flags [.], ack 4721, win 501, options [nop,nop,TS val 3729977607 ecr 107360990], length 0
